,Titles,Images,Years,Duration,Imdb Ratings,Descriptions
0,1. The Shawshank Redemption,"https://m.media-amazon.com/images/M/MV5BNDE3ODcxYzMtY2YzZC00NmNlLWJiNDMtZDViZWM2MzIxZDYwXkEyXkFqcGdeQXVyNjAwNDUxODI@._V1_QL75_UX140_CR0,1,140,207_.jpg",1994,2h 22m,9.3 (2.9M),"Over the course of several years, two convicts form a friendship, seeking consolation and, eventually, redemption through basic compassion."
1,2. The Godfather,"https://m.media-amazon.com/images/M/MV5BM2MyNjYxNmUtYTAwNi00MTYxLWJmNWYtYzZlODY3ZTk3OTFlXkEyXkFqcGdeQXVyNzkwMjQ5NzM@._V1_QL75_UY207_CR3,0,140,207_.jpg",1972,2h 55m,9.2 (2M),"Don Vito Corleone, head of a mafia family, decides to hand over his empire to his youngest son, Michael. However, his decision unintentionally puts the lives of his loved ones in grave danger."
2,3. The Dark Knight,"https://m.media-amazon.com/images/M/MV5BMTMxNTMwODM0NF5BMl5BanBnXkFtZTcwODAyMTk2Mw@@._V1_QL75_UX140_CR0,0,140,207_.jpg",2008,2h 32m,9.0 (2.9M),"When the menace known as the Joker wreaks havoc and chaos on the people of Gotham, Batman must accept one of the greatest psychological and physical tests of his ability to fight injustice."
3,4. The Godfather Part II,"https://m.media-amazon.com/images/M/MV5BMWMwMGQzZTItY2JlNC00OWZiLWIyMDctNDk2ZDQ2YjRjMWQ0XkEyXkFqcGdeQXVyNzkwMjQ5NzM@._V1_QL75_UY207_CR3,0,140,207_.jpg",1974,3h 22m,9.0 (1.4M),"The early life and career of Vito Corleone in 1920s New York City is portrayed, while his son, Michael, expands and tightens his grip on the family crime syndicate."
4,5. 12 Angry Men,"https://m.media-amazon.com/images/M/MV5BMWU4N2FjNzYtNTVkNC00NzQ0LTg0MjAtYTJlMjFhNGUxZDFmXkEyXkFqcGdeQXVyNjc1NTYyMjg@._V1_QL75_UX140_CR0,4,140,207_.jpg",1957,1h 36m,9.0 (873K),The jury in a New York City murder trial is frustrated by a single member whose skeptical caution forces them to more carefully consider the evidence before jumping to a hasty verdict.
5,6. Schindler's List,"https://m.media-amazon.com/images/M/MV5BNDE4OTMxMTctNmRhYy00NWE2LTg3YzItYTk3M2UwOTU5Njg4XkEyXkFqcGdeQXVyNjU0OTQ0OTY@._V1_QL75_UX140_CR0,1,140,207_.jpg",1993,3h 15m,9.0 (1.5M),"In German-occupied Poland during World War II, industrialist Oskar Schindler gradually becomes concerned for his Jewish workforce after witnessing their persecution by the Nazis."
6,7. The Lord of the Rings: The Return of the King,"https://m.media-amazon.com/images/M/MV5BNzA5ZDNlZWMtM2NhNS00NDJjLTk4NDItYTRmY2EwMWZlMTY3XkEyXkFqcGdeQXVyNzkwMjQ5NzM@._V1_QL75_UX140_CR0,0,140,207_.jpg",2003,3h 21m,9.0 (2M),Gandalf and Aragorn lead the World of Men against Sauron's army to draw his gaze from Frodo and Sam as they approach Mount Doom with the One Ring.
7,8. Pulp Fiction,"https://m.media-amazon.com/images/M/MV5BNGNhMDIzZTUtNTBlZi00MTRlLWFjM2ItYzViMjE3YzI5MjljXkEyXkFqcGdeQXVyNzkwMjQ5NzM@._V1_QL75_UY207_CR1,0,140,207_.jpg",1994,2h 34m,8.9 (2.2M),"The lives of two mob hitmen, a boxer, a gangster and his wife, and a pair of diner bandits intertwine in four tales of violence and redemption."
8,9. The Lord of the Rings: The Fellowship of the Ring,"https://m.media-amazon.com/images/M/MV5BN2EyZjM3NzUtNWUzMi00MTgxLWI0NTctMzY4M2VlOTdjZWRiXkEyXkFqcGdeQXVyNDUzOTQ5MjY@._V1_QL75_UX140_CR0,0,140,207_.jpg",2001,2h 58m,8.9 (2M),A meek Hobbit from the Shire and eight companions set out on a journey to destroy the powerful One Ring and save Middle-earth from the Dark Lord Sauron.
9,"10. The Good, the Bad and the Ugly","https://m.media-amazon.com/images/M/MV5BNjJlYmNkZGItM2NhYy00MjlmLTk5NmQtNjg1NmM2ODU4OTMwXkEyXkFqcGdeQXVyMjUzOTY1NTc@._V1_QL75_UX140_CR0,1,140,207_.jpg",1966,2h 58m,8.8 (817K),A bounty hunting scam joins two men in an uneasy alliance against a third in a race to find a fortune in gold buried in a remote cemetery.
10,11. Forrest Gump,"https://m.media-amazon.com/images/M/MV5BNWIwODRlZTUtY2U3ZS00Yzg1LWJhNzYtMmZiYmEyNmU1NjMzXkEyXkFqcGdeQXVyMTQxNzMzNDI@._V1_QL75_UY207_CR2,0,140,207_.jpg",1994,2h 22m,8.8 (2.3M),"The history of the United States from the 1950s to the '70s unfolds from the perspective of an Alabama man with an IQ of 75, who yearns to be reunited with his childhood sweetheart."
11,12. The Lord of the Rings: The Two Towers,"https://m.media-amazon.com/images/M/MV5BZGMxZTdjZmYtMmE2Ni00ZTdkLWI5NTgtNjlmMjBiNzU2MmI5XkEyXkFqcGdeQXVyNjU0OTQ0OTY@._V1_QL75_UX140_CR0,5,140,207_.jpg",2002,2h 59m,8.8 (1.8M),"While Frodo and Sam edge closer to Mordor with the help of the shifty Gollum, the divided fellowship makes a stand against Sauron's new ally, Saruman, and his hordes of Isengard."
12,13. Fight Club,"https://m.media-amazon.com/images/M/MV5BMmEzNTkxYjQtZTc0MC00YTVjLTg5ZTEtZWMwOWVlYzY0NWIwXkEyXkFqcGdeQXVyNzkwMjQ5NzM@._V1_QL75_UX140_CR0,1,140,207_.jpg",1999,2h 19m,8.8 (2.3M),An insomniac office worker and a devil-may-care soap maker form an underground fight club that evolves into much more.
13,14. Inception,"https://m.media-amazon.com/images/M/MV5BMjAxMzY3NjcxNF5BMl5BanBnXkFtZTcwNTI5OTM0Mw@@._V1_QL75_UX140_CR0,0,140,207_.jpg",2010,2h 28m,8.8 (2.6M),"A thief who steals corporate secrets through the use of dream-sharing technology is given the inverse task of planting an idea into the mind of a C.E.O., but his tragic past may doom the project and his team to disaster."
14,15. Star Wars: Episode V - The Empire Strikes Back,"https://m.media-amazon.com/images/M/MV5BYmU1NDRjNDgtMzhiMi00NjZmLTg5NGItZDNiZjU5NTU4OTE0XkEyXkFqcGdeQXVyNzkwMjQ5NzM@._V1_QL75_UX140_CR0,5,140,207_.jpg",1980,2h 4m,8.7 (1.4M),"After the Rebel Alliance are overpowered by the Empire, Luke Skywalker begins his Jedi training with Yoda, while his friends are pursued across the galaxy by Darth Vader and bounty hunter Boba Fett."
15,16. The Matrix,"https://m.media-amazon.com/images/M/MV5BNzQzOTk3OTAtNDQ0Zi00ZTVkLWI0MTEtMDllZjNkYzNjNTc4L2ltYWdlXkEyXkFqcGdeQXVyNjU0OTQ0OTY@._V1_QL75_UX140_CR0,1,140,207_.jpg",1999,2h 16m,8.7 (2.1M),"When a beautiful stranger leads computer hacker Neo to a forbidding underworld, he discovers the shocking truth--the life he knows is the elaborate deception of an evil cyber-intelligence."
16,17. Goodfellas,"https://m.media-amazon.com/images/M/MV5BY2NkZjEzMDgtN2RjYy00YzM1LWI4ZmQtMjIwYjFjNmI3ZGEwXkEyXkFqcGdeQXVyNzkwMjQ5NzM@._V1_QL75_UX140_CR0,1,140,207_.jpg",1990,2h 25m,8.7 (1.3M),"The story of Henry Hill and his life in the mafia, covering his relationship with his wife Karen and his mob partners Jimmy Conway and Tommy DeVito."
17,18. One Flew Over the Cuckoo's Nest,"https://m.media-amazon.com/images/M/MV5BZjA0OWVhOTAtYWQxNi00YzNhLWI4ZjYtNjFjZTEyYjJlNDVlL2ltYWdlL2ltYWdlXkEyXkFqcGdeQXVyMTQxNzMzNDI@._V1_QL75_UX140_CR0,0,140,207_.jpg",1975,2h 13m,8.7 (1.1M),"In the Fall of 1963, a Korean War veteran and criminal pleads insanity and is admitted to a mental institution, where he rallies up the scared patients against the tyrannical nurse."
18,19. Se7en,"https://m.media-amazon.com/images/M/MV5BOTUwODM5MTctZjczMi00OTk4LTg3NWUtNmVhMTAzNTNjYjcyXkEyXkFqcGdeQXVyNjU0OTQ0OTY@._V1_QL75_UX140_CR0,6,140,207_.jpg",1995,2h 7m,8.6 (1.8M),"Two detectives, a rookie and a veteran, hunt a serial killer who uses the seven deadly sins as his motives."
19,20. Interstellar,"https://m.media-amazon.com/images/M/MV5BZjdkOTU3MDktN2IxOS00OGEyLWFmMjktY2FiMmZkNWIyODZiXkEyXkFqcGdeQXVyMTMxODk2OTU@._V1_QL75_UX140_CR0,0,140,207_.jpg",2014,2h 49m,8.7 (2.1M),"When Earth becomes uninhabitable in the future, a farmer and ex-NASA pilot, Joseph Cooper, is tasked to pilot a spacecraft, along with a team of researchers, to find a new planet for humans."
20,21. It's a Wonderful Life,"https://m.media-amazon.com/images/M/MV5BZjc4NDZhZWMtNGEzYS00ZWU2LThlM2ItNTA0YzQ0OTExMTE2XkEyXkFqcGdeQXVyNjUwMzI2NzU@._V1_QL75_UY207_CR1,0,140,207_.jpg",1946,2h 10m,8.6 (502K),An angel is sent from Heaven to help a desperately frustrated businessman by showing him what life would have been like if he had never existed.
21,22. Seven Samurai,"https://m.media-amazon.com/images/M/MV5BOGNiY2QzOTAtOWNlZC00NjAwLWFmMTAtNTJhYTBiNTY4ODU0XkEyXkFqcGdeQXVyMTQyMTMwOTk0._V1_QL75_UX140_CR0,1,140,207_.jpg",1954,3h 27m,8.6 (369K),"Farmers from a village exploited by bandits hire a veteran samurai for protection, who gathers six other samurai to join him."
22,23. The Silence of the Lambs,"https://m.media-amazon.com/images/M/MV5BNjNhZTk0ZmEtNjJhMi00YzFlLWE1MmEtYzM1M2ZmMGMwMTU4XkEyXkFqcGdeQXVyNjU0OTQ0OTY@._V1_QL75_UY207_CR0,0,140,207_.jpg",1991,1h 58m,8.6 (1.6M),"A young F.B.I. cadet must receive the help of an incarcerated and manipulative cannibal killer to help catch another serial killer, a madman who skins his victims."
23,24. Saving Private Ryan,"https://m.media-amazon.com/images/M/MV5BZjhkMDM4MWItZTVjOC00ZDRhLThmYTAtM2I5NzBmNmNlMzI1XkEyXkFqcGdeQXVyNDYyMDk5MTU@._V1_QL75_UY207_CR1,0,140,207_.jpg",1998,2h 49m,8.6 (1.5M),"Following the Normandy Landings, a group of U.S. soldiers go behind enemy lines to retrieve a paratrooper whose brothers have been killed in action."
24,25. City of God,"https://m.media-amazon.com/images/M/MV5BMGU5OWEwZDItNmNkMC00NzZmLTk1YTctNzVhZTJjM2NlZTVmXkEyXkFqcGdeQXVyMTMxODk2OTU@._V1_QL75_UY207_CR0,0,140,207_.jpg",2002,2h 10m,8.6 (806K),"In the slums of Rio, two kids' paths diverge as one struggles to become a photographer and the other a kingpin."
25,26. Life Is Beautiful,"https://m.media-amazon.com/images/M/MV5BYmJmM2Q4NmMtYThmNC00ZjRlLWEyZmItZTIwOTBlZDQ3NTQ1XkEyXkFqcGdeQXVyMTQxNzMzNDI@._V1_QL75_UX140_CR0,1,140,207_.jpg",1997,1h 56m,8.6 (748K),"When an open-minded Jewish waiter and his son become victims of the Holocaust, he uses a perfect mixture of will, humor and imagination to protect his son from the dangers around their camp."
26,27. The Green Mile,"https://m.media-amazon.com/images/M/MV5BMTUxMzQyNjA5MF5BMl5BanBnXkFtZTYwOTU2NTY3._V1_QL75_UX140_CR0,0,140,207_.jpg",1999,3h 9m,8.6 (1.4M),"A tale set on death row, where gentle giant John Coffey possesses the mysterious power to heal people's ailments. When the lead guard, Paul Edgecombe, recognizes John's gift, he tries to help stave off the condemned man's execution."
27,28. Terminator 2: Judgment Day,"https://m.media-amazon.com/images/M/MV5BMGU2NzRmZjUtOGUxYS00ZjdjLWEwZWItY2NlM2JhNjkxNTFmXkEyXkFqcGdeQXVyNjU0OTQ0OTY@._V1_QL75_UX140_CR0,0,140,207_.jpg",1991,2h 17m,8.6 (1.2M),"A cyborg, identical to the one who failed to kill Sarah Connor, must now protect her ten year old son John from an even more advanced and powerful cyborg."
28,29. Star Wars: Episode IV - A New Hope,"https://m.media-amazon.com/images/M/MV5BOTA5NjhiOTAtZWM0ZC00MWNhLThiMzEtZDFkOTk2OTU1ZDJkXkEyXkFqcGdeQXVyMTA4NDI1NTQx._V1_QL75_UX140_CR0,3,140,207_.jpg",1977,2h 1m,8.6 (1.5M),"Luke Skywalker joins forces with a Jedi Knight, a cocky pilot, a Wookiee and two droids to save the galaxy from the Empire's world-destroying battle station, while also attempting to rescue Princess Leia from the mysterious Darth Vader."
29,30. Back to the Future,"https://m.media-amazon.com/images/M/MV5BZmU0M2Y1OGUtZjIxNi00ZjBkLTg1MjgtOWIyNThiZWIwYjRiXkEyXkFqcGdeQXVyMTQxNzMzNDI@._V1_QL75_UX140_CR0,5,140,207_.jpg",1985,1h 56m,8.5 (1.3M),"Marty McFly, a 17-year-old high school student, is accidentally sent 30 years into the past in a time-traveling DeLorean invented by his close friend, the maverick scientist Doc Brown."
30,31. Spirited Away,"https://m.media-amazon.com/images/M/MV5BMjlmZmI5MDctNDE2YS00YWE0LWE5ZWItZDBhYWQ0NTcxNWRhXkEyXkFqcGdeQXVyMTMxODk2OTU@._V1_QL75_UX140_CR0,0,140,207_.jpg",2001,2h 5m,8.6 (858K),"During her family's move to the suburbs, a sullen 10-year-old girl wanders into a world ruled by gods, witches and spirits, and where humans are changed into beasts."
31,32. The Pianist,"https://m.media-amazon.com/images/M/MV5BOWRiZDIxZjktMTA1NC00MDQ2LWEzMjUtMTliZmY3NjQ3ODJiXkEyXkFqcGdeQXVyNjU0OTQ0OTY@._V1_QL75_UY207_CR5,0,140,207_.jpg",2002,2h 30m,8.5 (921K),"During WWII, acclaimed Polish musician Wladyslaw faces various struggles as he loses contact with his family. As the situation worsens, he hides in the ruins of Warsaw in order to survive."
32,33. Dune: Part Two,"https://m.media-amazon.com/images/M/MV5BN2QyZGU4ZDctOWMzMy00NTc5LThlOGQtODhmNDI1NmY5YzAwXkEyXkFqcGdeQXVyMDM2NDM2MQ@@._V1_QL75_UX140_CR0,0,140,207_.jpg",2024,2h 46m,8.6 (463K),Paul Atreides unites with Chani and the Fremen while seeking revenge against the conspirators who destroyed his family.
33,34. Parasite,"https://m.media-amazon.com/images/M/MV5BYWZjMjk3ZTItODQ2ZC00NTY5LWE0ZDYtZTI3MjcwN2Q5NTVkXkEyXkFqcGdeQXVyODk4OTc3MTY@._V1_QL75_UX140_CR0,0,140,207_.jpg",2019,2h 12m,8.5 (974K),Greed and class discrimination threaten the newly-formed symbiotic relationship between the wealthy Park family and the destitute Kim clan.
34,35. Psycho,"https://m.media-amazon.com/images/M/MV5BNTQwNDM1YzItNDAxZC00NWY2LTk0M2UtNDIwNWI5OGUyNWUxXkEyXkFqcGdeQXVyNzkwMjQ5NzM@._V1_QL75_UX140_CR0,0,140,207_.jpg",1960,1h 49m,8.5 (723K),A secretary on the run for embezzlement takes refuge at a secluded California motel owned by a repressed man and his overbearing mother.
35,36. Gladiator,"https://m.media-amazon.com/images/M/MV5BMDliMmNhNDEtODUyOS00MjNlLTgxODEtN2U3NzIxMGVkZTA1L2ltYWdlXkEyXkFqcGdeQXVyNjU0OTQ0OTY@._V1_QL75_UX140_CR0,0,140,207_.jpg",2000,2h 35m,8.5 (1.6M),A former Roman General sets out to exact vengeance against the corrupt emperor who murdered his family and sent him into slavery.
36,37. Spider-Man: Across the Spider-Verse,"https://m.media-amazon.com/images/M/MV5BMzI0NmVkMjEtYmY4MS00ZDMxLTlkZmEtMzU4MDQxYTMzMjU2XkEyXkFqcGdeQXVyMzQ0MzA0NTM@._V1_QL75_UX140_CR0,0,140,207_.jpg",2023,2h 20m,8.6 (382K),"Miles Morales catapults across the multiverse, where he encounters a team of Spider-People charged with protecting its very existence. When the heroes clash on how to handle a new threat, Miles must redefine what it means to be a hero."
37,38. The Lion King,"https://m.media-amazon.com/images/M/MV5BYTYxNGMyZTYtMjE3MS00MzNjLWFjNmYtMDk3N2FmM2JiM2M1XkEyXkFqcGdeQXVyNjY5NDU4NzI@._V1_QL75_UX140_CR0,0,140,207_.jpg",1994,1h 28m,8.5 (1.2M),"Lion prince Simba and his father are targeted by his bitter uncle, who wants to ascend the throne himself."
38,39. The Departed,"https://m.media-amazon.com/images/M/MV5BMTI1MTY2OTIxNV5BMl5BanBnXkFtZTYwNjQ4NjY3._V1_QL75_UY207_CR0,0,140,207_.jpg",2006,2h 31m,8.5 (1.4M),An undercover cop and a mole in the police attempt to identify each other while infiltrating an Irish gang in South Boston.
39,40. Léon: The Professional,"https://m.media-amazon.com/images/M/MV5BOTgyMWQ0ZWUtN2Q2MS00NmY0LWI3OWMtNjFkMzZlNDZjNTk0XkEyXkFqcGdeQXVyMjUzOTY1NTc@._V1_QL75_UX140_CR0,1,140,207_.jpg",1994,1h 50m,8.5 (1.3M),"12-year-old Mathilda is reluctantly taken in by Léon, a professional assassin, after her family is murdered. An unusual relationship forms as she becomes his protégée and learns the assassin's trade."
40,41. American History X,"https://m.media-amazon.com/images/M/MV5BZTJhN2FkYWEtMGI0My00YWM4LWI2MjAtM2UwNjY4MTI2ZTQyXkEyXkFqcGdeQXVyNjc3MjQzNTI@._V1_QL75_UX140_CR0,0,140,207_.jpg",1998,1h 59m,8.5 (1.2M),"Living a life marked by violence, neo-Nazi Derek finally goes to prison after killing two black youths. Upon his release, Derek vows to change; he hopes to prevent his brother, Danny, who idolizes Derek, from following in his footsteps."
41,42. Whiplash,"https://m.media-amazon.com/images/M/MV5BOTA5NDZlZGUtMjAxOS00YTRkLTkwYmMtYWQ0NWEwZDZiNjEzXkEyXkFqcGdeQXVyMTMxODk2OTU@._V1_QL75_UX140_CR0,0,140,207_.jpg",2014,1h 46m,8.5 (1M),A promising young drummer enrolls at a cut-throat music conservatory where his dreams of greatness are mentored by an instructor who will stop at nothing to realize a student's potential.
42,43. The Prestige,"https://m.media-amazon.com/images/M/MV5BMTM3MzQ5MjQ5OF5BMl5BanBnXkFtZTcwMTQ3NzMzMw@@._V1_QL75_UY207_CR0,0,140,207_.jpg",2006,2h 10m,8.5 (1.5M),"After a tragic accident, two stage magicians in 1890s London engage in a battle to create the ultimate illusion while sacrificing everything they have to outwit each other."
43,44. Grave of the Fireflies,"https://m.media-amazon.com/images/M/MV5BZmY2NjUzNDQtNTgxNC00M2Q4LTljOWQtMjNjNDBjNWUxNmJlXkEyXkFqcGdeQXVyNTA4NzY1MzY@._V1_QL75_UX140_CR0,1,140,207_.jpg",1988,1h 29m,8.5 (314K),A young boy and his little sister struggle to survive in Japan during World War II.
44,45. Harakiri,"https://m.media-amazon.com/images/M/MV5BMWNmYzg5NWYtNzhiMS00NzlkLTgyOTUtYzM3MjY0NDc2YjFkXkEyXkFqcGdeQXVyNzkwMjQ5NzM@._V1_QL75_UY207_CR2,0,140,207_.jpg",1962,2h 13m,8.6 (70K),"When a ronin requesting seppuku at a feudal lord's palace is told of the brutal suicide of another ronin who previously visited, he reveals how their pasts are intertwined - and in doing so challenges the clan's integrity."
45,46. The Usual Suspects,"https://m.media-amazon.com/images/M/MV5BYTViNjMyNmUtNDFkNC00ZDRlLThmMDUtZDU2YWE4NGI2ZjVmXkEyXkFqcGdeQXVyNjU0OTQ0OTY@._V1_QL75_UX140_CR0,1,140,207_.jpg",1995,1h 46m,8.5 (1.2M),The sole survivor of a pier shoot-out tells the story of how a notorious criminal influenced the events that began with five criminals meeting in a seemingly random police lineup.
46,47. Casablanca,"https://m.media-amazon.com/images/M/MV5BY2IzZGY2YmEtYzljNS00NTM5LTgwMzUtMzM1NjQ4NGI0OTk0XkEyXkFqcGdeQXVyNDYyMDk5MTU@._V1_QL75_UX140_CR0,2,140,207_.jpg",1942,1h 42m,8.5 (609K),A cynical expatriate American cafe owner struggles to decide whether or not to help his former lover and her fugitive husband escape the Nazis in French Morocco.
47,48. The Intouchables,"https://m.media-amazon.com/images/M/MV5BMTYxNDA3MDQwNl5BMl5BanBnXkFtZTcwNTU4Mzc1Nw@@._V1_QL75_UX140_CR0,0,140,207_.jpg",2011,1h 52m,8.5 (936K),"After he becomes a quadriplegic from a paragliding accident, an aristocrat hires a young man from the projects to be his caregiver."
48,49. Cinema Paradiso,"https://m.media-amazon.com/images/M/MV5BM2FhYjEyYmYtMDI1Yy00YTdlLWI2NWQtYmEzNzAxOGY1NjY2XkEyXkFqcGdeQXVyNTA3NTIyNDg@._V1_QL75_UX140_CR0,0,140,207_.jpg",1988,2h 54m,8.5 (285K),A filmmaker recalls his childhood when falling in love with the pictures at the cinema of his home village and forms a deep friendship with the cinema's projectionist.
49,50. Modern Times,"https://m.media-amazon.com/images/M/MV5BM2VlMjY3N2UtN2ZjNC00MDg4LWI3ZGQtZmE4NjZkZjkwZmYzXkEyXkFqcGdeQXVyMTU3NDU4MDg2._V1_QL75_UX140_CR0,0,140,207_.jpg",1936,1h 27m,8.5 (261K),The Tramp struggles to live in modern industrial society with the help of a young homeless woman.
50,51. Rear Window,"https://m.media-amazon.com/images/M/MV5BNGUxYWM3M2MtMGM3Mi00ZmRiLWE0NGQtZjE5ODI2OTJhNTU0XkEyXkFqcGdeQXVyMTQxNzMzNDI@._V1_QL75_UY207_CR1,0,140,207_.jpg",1954,1h 52m,8.5 (526K),"A wheelchair-bound photographer spies on his neighbors from his Greenwich Village courtyard apartment window and, despite the skepticism of his fashion-model girlfriend, becomes convinced one of them has committed murder."
51,52. Once Upon a Time in the West,"https://m.media-amazon.com/images/M/MV5BODQ3NDExOGYtMzI3Mi00NWRlLTkwNjAtNjc4MDgzZGJiZTA1XkEyXkFqcGdeQXVyMjUzOTY1NTc@._V1_QL75_UX140_CR0,1,140,207_.jpg",1968,2h 46m,8.5 (351K),A mysterious stranger with a harmonica joins forces with a notorious desperado to protect a beautiful widow from a ruthless assassin working for the railroad.
52,53. Alien,"https://m.media-amazon.com/images/M/MV5BOGQzZTBjMjQtOTVmMS00NGE5LWEyYmMtOGQ1ZGZjNmRkYjFhXkEyXkFqcGdeQXVyMjUzOTY1NTc@._V1_QL75_UX140_CR0,2,140,207_.jpg",1979,1h 57m,8.5 (959K),The crew of a commercial spacecraft encounters a deadly lifeform after investigating a mysterious transmission of unknown origin.
53,54. City Lights,"https://m.media-amazon.com/images/M/MV5BY2I4MmM1N2EtM2YzOS00OWUzLTkzYzctNDc5NDg2N2IyODJmXkEyXkFqcGdeQXVyNzkwMjQ5NzM@._V1_QL75_UX140_CR0,1,140,207_.jpg",1931,1h 27m,8.5 (197K),"With the aid of a wealthy erratic tippler, a dewy-eyed tramp who has fallen in love with a sightless flower girl accumulates money to be able to help her medically."
54,55. Django Unchained,"https://m.media-amazon.com/images/M/MV5BMjIyNTQ5NjQ1OV5BMl5BanBnXkFtZTcwODg1MDU4OA@@._V1_QL75_UX140_CR0,0,140,207_.jpg",2012,2h 45m,8.5 (1.7M),"With the help of a German bounty-hunter, a freed slave sets out to rescue his wife from a brutal plantation owner in Mississippi."
55,56. Apocalypse Now,"https://m.media-amazon.com/images/M/MV5BYmQyNTA1ZGItNjZjMi00NzFlLWEzMWEtNWMwN2Q2MjJhYzEyXkEyXkFqcGdeQXVyMjUzOTY1NTc@._V1_QL75_UX140_CR0,4,140,207_.jpg",1979,2h 27m,8.4 (715K),A U.S. Army officer serving in Vietnam is tasked with assassinating a renegade Special Forces Colonel who sees himself as a god.
56,57. Memento,"https://m.media-amazon.com/images/M/MV5BZTcyNjk1MjgtOWI3Mi00YzQwLWI5MTktMzY4ZmI2NDAyNzYzXkEyXkFqcGdeQXVyNjU0OTQ0OTY@._V1_QL75_UY207_CR1,0,140,207_.jpg",2000,1h 53m,8.4 (1.3M),"Leonard Shelby, an insurance investigator, suffers from anterograde amnesia and uses notes and tattoos to hunt for the man he thinks killed his wife, which is the last thing he remembers."
57,58. WALL·E,"https://m.media-amazon.com/images/M/MV5BMjExMTg5OTU0NF5BMl5BanBnXkFtZTcwMjMxMzMzMw@@._V1_QL75_UX140_CR0,0,140,207_.jpg",2008,1h 38m,8.4 (1.2M),"In the distant future, a small waste-collecting robot inadvertently embarks on a space journey that will ultimately decide the fate of mankind."
58,59. 12th Fail,"https://m.media-amazon.com/images/M/MV5BZDI4OTM1ZjMtOWQxMC00OTY5LTg3NjQtMjlhMWVjODFlYTY4XkEyXkFqcGdeQXVyMTYzMTU3Njgx._V1_QL75_UY207_CR9,0,140,207_.jpg",2023,2h 27m,8.9 (120K),The real-life story of IPS Officer Manoj Kumar Sharma and IRS Officer Shraddha Joshi.
59,60. Raiders of the Lost Ark,"https://m.media-amazon.com/images/M/MV5BNTU2ODkyY2MtMjU1NC00NjE1LWEzYjgtMWQ3MzRhMTE0NDc0XkEyXkFqcGdeQXVyMjM4MzQ4OTQ@._V1_QL75_UY207_CR1,0,140,207_.jpg",1981,1h 55m,8.4 (1M),"In 1936, archaeologist and adventurer Indiana Jones is hired by the U.S. government to find the Ark of the Covenant before the Nazis can obtain its awesome powers."
60,61. The Lives of Others,"https://m.media-amazon.com/images/M/MV5BNmQyNmJjM2ItNTQzYi00ZjMxLWFjMDYtZjUyN2YwZDk5YWQ2XkEyXkFqcGdeQXVyMjUzOTY1NTc@._V1_QL75_UX140_CR0,1,140,207_.jpg",2006,2h 17m,8.4 (413K),"In 1984 East Berlin, an agent of the secret police conducting surveillance on a writer and his lover finds himself becoming increasingly absorbed by their lives."
61,62. Sunset Boulevard,"https://m.media-amazon.com/images/M/MV5BMTU0NTkyNzYwMF5BMl5BanBnXkFtZTgwMDU0NDk5MTI@._V1_QL75_UX140_CR0,2,140,207_.jpg",1950,1h 50m,8.4 (238K),A screenwriter develops a dangerous relationship with a faded film star determined to make a triumphant return.
62,63. Avengers: Infinity War,"https://m.media-amazon.com/images/M/MV5BMjMxNjY2MDU1OV5BMl5BanBnXkFtZTgwNzY1MTUwNTM@._V1_QL75_UX140_CR0,0,140,207_.jpg",2018,2h 29m,8.4 (1.2M),The Avengers and their allies must be willing to sacrifice all in an attempt to defeat the powerful Thanos before his blitz of devastation and ruin puts an end to the universe.
63,64. Paths of Glory,"https://m.media-amazon.com/images/M/MV5BOTI5Nzc0OTMtYzBkMS00NjkxLThmM2UtNjM2ODgxN2M5NjNkXkEyXkFqcGdeQXVyNjQ2MjQ5NzM@._V1_QL75_UX140_CR0,3,140,207_.jpg",1957,1h 28m,8.4 (214K),"After a failed attack on a German position, a general orders three soldiers, chosen at random, court-martialed for cowardice and their commanding officer must defend them."
64,65. Spider-Man: Into the Spider-Verse,"https://m.media-amazon.com/images/M/MV5BMjMwNDkxMTgzOF5BMl5BanBnXkFtZTgwNTkwNTQ3NjM@._V1_QL75_UX140_CR0,0,140,207_.jpg",2018,1h 57m,8.4 (680K),Teen Miles Morales becomes the Spider-Man of his universe and must join with five spider-powered individuals from other dimensions to stop a threat for all realities.
65,66. Witness for the Prosecution,"https://m.media-amazon.com/images/M/MV5BNDQwODU5OWYtNDcyNi00MDQ1LThiOGMtZDkwNWJiM2Y3MDg0XkEyXkFqcGdeQXVyMDI2NDg0NQ@@._V1_QL75_UX140_CR0,3,140,207_.jpg",1957,1h 56m,8.4 (139K),A veteran British barrister must defend his client in a murder trial that has surprise after surprise.
66,67. The Shining,"https://m.media-amazon.com/images/M/MV5BZWFlYmY2MGEtZjVkYS00YzU4LTg0YjQtYzY1ZGE3NTA5NGQxXkEyXkFqcGdeQXVyMTQxNzMzNDI@._V1_QL75_UX140_CR0,3,140,207_.jpg",1980,2h 26m,8.4 (1.1M),"A family heads to an isolated hotel for the winter where a sinister presence influences the father into violence, while his psychic son sees horrific forebodings from both past and future."
67,68. The Great Dictator,"https://m.media-amazon.com/images/M/MV5BMjc4ZjEwNDUtMjlmZS00NzQ4LTg2N2MtMGI3ZjMyMmM3ZDM2XkEyXkFqcGc@._V1_QL75_UX140_CR0,0,140,207_.jpg",1940,2h 5m,8.4 (239K),Dictator Adenoid Hynkel tries to expand his empire while a poor Jewish barber tries to avoid persecution from Hynkel's regime.
68,69. Aliens,"https://m.media-amazon.com/images/M/MV5BOGJkY2EyOWYtYWRmNy00ZTEzLTllMDAtYzYzYjA0ZjFhZWJjXkEyXkFqcGdeQXVyMTUzMDUzNTI3._V1_QL75_UX140_CR0,2,140,207_.jpg",1986,2h 17m,8.4 (768K),"Decades after surviving the Nostromo incident, Ellen Ripley is sent out to re-establish contact with a terraforming colony but finds herself battling the Alien Queen and her offspring."
69,70. Inglourious Basterds,"https://m.media-amazon.com/images/M/MV5BOTJiNDEzOWYtMTVjOC00ZjlmLWE0NGMtZmE1OWVmZDQ2OWJhXkEyXkFqcGdeQXVyNTIzOTk5ODM@._V1_QL75_UX140_CR0,0,140,207_.jpg",2009,2h 33m,8.4 (1.6M),"In Nazi-occupied France during World War II, a plan to assassinate Nazi leaders by a group of Jewish U.S. soldiers coincides with a theatre owner's vengeful plans for the same."
70,71. The Dark Knight Rises,"https://m.media-amazon.com/images/M/MV5BMTk4ODQzNDY3Ml5BMl5BanBnXkFtZTcwODA0NTM4Nw@@._V1_QL75_UX140_CR0,0,140,207_.jpg",2012,2h 44m,8.4 (1.8M),"Eight years after the Joker's reign of chaos, Batman is coerced out of exile with the assistance of the mysterious Selina Kyle in order to defend Gotham City from the vicious guerrilla terrorist Bane."
