,Titles,Images,Years,Duration,Imdb Ratings,Descriptions
214,215. Logan,"https://m.media-amazon.com/images/M/MV5BYzc5MTU4N2EtYTkyMi00NjdhLTg3NWEtMTY4OTEyMzJhZTAzXkEyXkFqcGdeQXVyNjc1NTYyMjg@._V1_QL75_UX140_CR0,1,140,207_.jpg",2017,2h 17m,8.1 (839K),"In a future where mutants are nearly extinct, an elderly and weary Logan leads a quiet life. But when Laura, a mutant child pursued by scientists, comes to him for help, he must get her to safety."
215,216. Spotlight,"https://m.media-amazon.com/images/M/MV5BMjIyOTM5OTIzNV5BMl5BanBnXkFtZTgwMDkzODE2NjE@._V1_QL75_UY207_CR0,0,140,207_.jpg",2015,2h 9m,8.1 (505K),"The true story of how the Boston Globe uncovered the massive scandal of child molestation and cover-up within the local Catholic Archdiocese, shaking the entire Catholic Church to its core."
216,217. Hotel Rwanda,"https://m.media-amazon.com/images/M/MV5BZGJjYmIzZmQtNWE4Yy00ZGVmLWJkZGEtMzUzNmQ4ZWFlMjRhXkEyXkFqcGdeQXVyMTMxODk2OTU@._V1_QL75_UY207_CR0,0,140,207_.jpg",2004,2h 1m,8.1 (374K),"Paul Rusesabagina, a hotel manager, houses over a thousand Tutsi refugees during their struggle against the Hutu militia in Rwanda, Africa."
217,218. The Terminator,"https://m.media-amazon.com/images/M/MV5BYTViNzMxZjEtZGEwNy00MDNiLWIzNGQtZDY2MjQ1OWViZjFmXkEyXkFqcGdeQXVyNzkwMjQ5NzM@._V1_QL75_UX140_CR0,1,140,207_.jpg",1984,1h 47m,8.1 (931K),"A human soldier is sent from 2029 to 1984 to stop an almost indestructible cyborg killing machine, sent from the same year, which has been programmed to execute a young woman whose unborn son is the key to humanity's future salvation."
218,219. Platoon,"https://m.media-amazon.com/images/M/MV5BMzRjZjdlMjQtODVkYS00N2YzLWJlYWYtMGVlN2E5MWEwMWQzXkEyXkFqcGdeQXVyMTQxNzMzNDI@._V1_QL75_UX140_CR0,6,140,207_.jpg",1986,2h,8.1 (442K),"Chris Taylor, a neophyte recruit in Vietnam, finds himself caught in a battle of wills between two sergeants, one good and the other evil. A shrewd examination of the brutality of war and the duality of man in conflict."
219,220. La haine,"https://m.media-amazon.com/images/M/MV5BOTQxOGU0OWUtMzExYy00ZjIxLWJmMzAtNTI1Y2YxYTMxN2RkXkEyXkFqcGdeQXVyMjUzOTY1NTc@._V1_QL75_UX140_CR0,0,140,207_.jpg",1995,1h 38m,8.1 (199K),24 hours in the lives of three young men in the French suburbs the day after a violent riot.
220,221. The Passion of Joan of Arc,"https://m.media-amazon.com/images/M/MV5BNjBjNDJiYTUtOWY0OS00OGVmLTg2YzctMTE0NzVhODM1ZWJmXkEyXkFqcGdeQXVyNjU0OTQ0OTY@._V1_QL75_UX140_CR0,6,140,207_.jpg",1928,1h 54m,8.1 (61K),"In 1431, Jeanne d'Arc is placed on trial on charges of heresy. The ecclesiastical jurists attempt to force Jeanne to recant her claims of holy visions."
221,222. Before Sunset,"https://m.media-amazon.com/images/M/MV5BMTQ1MjAwNTM5Ml5BMl5BanBnXkFtZTYwNDM0MTc3._V1_QL75_UY207_CR0,0,140,207_.jpg",2004,1h 20m,8.1 (290K),"Nine years after Jesse and Celine first met, they encounter each other again on the French leg of Jesse's book tour."
222,223. Pirates of the Caribbean: The Curse of the Black Pearl,"https://m.media-amazon.com/images/M/MV5BNGYyZGM5MGMtYTY2Ni00M2Y1LWIzNjQtYWUzM2VlNGVhMDNhXkEyXkFqcGdeQXVyMTMxODk2OTU@._V1_QL75_UX140_CR0,1,140,207_.jpg",2003,2h 23m,8.1 (1.2M),"Blacksmith Will Turner teams up with eccentric pirate ""Captain"" Jack Sparrow to save Elizabeth Swann, the governor's daughter and his love, from Jack's former pirate allies, who are now undead."
223,224. The Best Years of Our Lives,"https://m.media-amazon.com/images/M/MV5BY2RmNTRjYzctODI4Ni00MzQyLWEyNTAtNjU0N2JkMTNhNjJkXkEyXkFqcGdeQXVyNjU0OTQ0OTY@._V1_QL75_UX140_CR0,1,140,207_.jpg",1946,2h 50m,8.1 (71K),"Three World War II veterans, two of them traumatized or disabled, return home to the American midwest to discover that they and their families have been irreparably changed."
224,225. Jai Bhim,"https://m.media-amazon.com/images/M/MV5BNzFkM2FhMzQtYjUwZi00N2Y3LWFkZWItMmZmMjQxNGQwZmNhXkEyXkFqcGdeQXVyODEyNjEwMDk@._V1_QL75_UY207_CR13,0,140,207_.jpg",2021,2h 44m,8.7 (218K),"When a tribal man is arrested for a case of alleged theft, his wife turns to a human-rights lawyer to help bring justice."
225,226. The Exorcist,"https://m.media-amazon.com/images/M/MV5BYWFlZGY2NDktY2ZjOS00ZWNkLTg0ZDAtZDY4MTM1ODU4ZjljXkEyXkFqcGdeQXVyMjUzOTY1NTc@._V1_QL75_UX140_CR0,3,140,207_.jpg",1973,2h 2m,8.1 (458K),"When a young girl is possessed by a mysterious entity, her mother seeks the help of two Catholic priests to save her life."
226,227. Rush,"https://m.media-amazon.com/images/M/MV5BOWEwODJmZDItYTNmZC00OGM4LThlNDktOTQzZjIzMGQxODA4XkEyXkFqcGdeQXVyNjU0OTQ0OTY@._V1_QL75_UX140_CR0,0,140,207_.jpg",2013,2h 3m,8.1 (517K),The merciless 1970s rivalry between Formula One rivals James Hunt and Niki Lauda.
227,228. Network,"https://m.media-amazon.com/images/M/MV5BNzY0NjU5ODUtOTAzMC00NTU5LWJkZjctYWMyOWY2MTZmOWM1XkEyXkFqcGdeQXVyMTI3ODAyMzE2._V1_QL75_UX140_CR0,3,140,207_.jpg",1976,2h 1m,8.1 (172K),"A television network cynically exploits a deranged former anchor's ravings and revelations about the news media for its own profit, but finds that his message may be difficult to control."
228,229. The Wizard of Oz,"https://m.media-amazon.com/images/M/MV5BY2NjNDU1ZjctN2VhZi00Nzc5LTljNmItMTZiOTg1ODkwYjgwXkEyXkFqcGdeQXVyNTkxMzEwMzU@._V1_QL75_UX140_CR0,3,140,207_.jpg",1939,1h 42m,8.1 (431K),"Young Dorothy Gale and her dog Toto are swept away by a tornado from their Kansas farm to the magical Land of Oz, and embark on a quest with three new friends to see the Wizard, who can return her to her home and fulfill the others' wishes."
229,230. Stand by Me,"https://m.media-amazon.com/images/M/MV5BODJmY2Y2OGQtMDg2My00N2Q3LWJmZTUtYTc2ODBjZDVlNDlhXkEyXkFqcGdeQXVyMTQxNzMzNDI@._V1_QL75_UX140_CR0,6,140,207_.jpg",1986,1h 29m,8.1 (445K),A writer recounts a childhood journey with his friends to find the body of a missing boy.
230,231. The Incredibles,"https://m.media-amazon.com/images/M/MV5BMTY5OTU0OTc2NV5BMl5BanBnXkFtZTcwMzU4MDcyMQ@@._V1_QL75_UX140_CR0,0,140,207_.jpg",2004,1h 55m,8.0 (816K),"While trying to lead a quiet suburban life, a family of undercover superheroes are forced into action to save the world."
231,232. Hachi: A Dog's Tale,"https://m.media-amazon.com/images/M/MV5BYmQzYjgyYzEtOTVhZC00MDRkLWJjNjItYzU3N2RiMTExZjA1XkEyXkFqcGdeQXVyMTcwOTQzOTYy._V1_QL75_UX140_CR0,0,140,207_.jpg",2009,1h 33m,8.1 (314K),"Professor Wilson discovers a lost Akita puppy on his way home. Despite objections from his wife, Hachi endears himself to the family and grows to be Parker's loyal companion. As their bond grows deeper, a beautiful relationship unfolds."
232,233. The Sound of Music,"https://m.media-amazon.com/images/M/MV5BYThiZTY5MTAtODgwNS00OGNjLThjYzItOTcxYmYxMGY5MzBjXkEyXkFqcGdeQXVyNjc5NjEzNA@@._V1_QL75_UX140_CR0,1,140,207_.jpg",1965,2h 52m,8.1 (263K),A young novice is sent by her convent in 1930s Austria to become a governess to the seven children of a widowed naval officer.
233,234. The Handmaiden,"https://m.media-amazon.com/images/M/MV5BNDJhYTk2MTctZmVmOS00OTViLTgxNjQtMzQxOTRiMDdmNGRjXkEyXkFqcGdeQXVyMTMxODk2OTU@._V1_QL75_UY207_CR2,0,140,207_.jpg",2016,2h 25m,8.1 (175K),"A woman is hired as a handmaiden to a Japanese heiress, but secretly she is involved in a plot to defraud her."
234,235. My Father and My Son,"https://m.media-amazon.com/images/M/MV5BNzEzMWYyYjEtNmVjZS00YTAyLWIyOTgtMzEzNzQxMTQzZTgwXkEyXkFqcGdeQXVyMTA0MTM5NjI2._V1_QL75_UX140_CR0,1,140,207_.jpg",2005,1h 52m,8.2 (93K),The family of a left-wing journalist is torn apart after the military coup of Turkey in 1980.
235,236. Into the Wild,"https://m.media-amazon.com/images/M/MV5BNjQ0ODlhMWUtNmUwMS00YjExLWI4MjQtNjVmMmE2Y2E0MGRmXkEyXkFqcGdeQXVyNDk3NzU2MTQ@._V1_QL75_UY207_CR0,0,140,207_.jpg",2007,2h 28m,8.1 (661K),"After graduating from Emory University, top student and athlete Christopher McCandless abandons his possessions, gives his entire $24,000 savings account to charity and hitchhikes to Alaska to live in the wilderness. Along the way, Christopher encounters a series of characters that shape his life."
236,237. To Be or Not to Be,"https://m.media-amazon.com/images/M/MV5BYTIwNDcyMjktMTczMy00NDM5LTlhNDEtMmE3NGVjOTM2YjQ3XkEyXkFqcGdeQXVyNjc0MzMzNjA@._V1_QL75_UX140_CR0,1,140,207_.jpg",1942,1h 39m,8.1 (44K),"During the German occupation of Poland, an acting troupe becomes embroiled in a Polish soldier's efforts to track down a German spy."
237,238. The Battle of Algiers,"https://m.media-amazon.com/images/M/MV5BN2M4YTA4ZTEtN2EyNy00YTlmLWE4YzYtYjYyYjRkMWM4ZDM0XkEyXkFqcGdeQXVyMjUzOTY1NTc@._V1_QL75_UX140_CR0,3,140,207_.jpg",1966,2h 1m,8.1 (66K),"In the 1950s, fear and violence escalate as the people of Algiers fight for independence from the French government."
238,239. The Grapes of Wrath,"https://m.media-amazon.com/images/M/MV5BNzJiOGI2MjctYjUyMS00ZjkzLWE2ZmUtOTg4NTZkOTNhZDc1L2ltYWdlXkEyXkFqcGdeQXVyNjc1NTYyMjg@._V1_QL75_UX140_CR0,0,140,207_.jpg",1940,2h 9m,8.1 (101K),"An Oklahoma family, driven off their farm by the poverty and hopelessness of the Dust Bowl, joins the westward migration to California, suffering the misfortunes of the homeless in the Great Depression."
239,240. Groundhog Day,"https://m.media-amazon.com/images/M/MV5BZWIxNzM5YzQtY2FmMS00Yjc3LWI1ZjUtNGVjMjMzZTIxZTIxXkEyXkFqcGdeQXVyNjU0OTQ0OTY@._V1_QL75_UX140_CR0,0,140,207_.jpg",1993,1h 41m,8.0 (689K),"A narcissistic, self-centered weatherman finds himself in a time loop on Groundhog Day."
240,241. Amores Perros,"https://m.media-amazon.com/images/M/MV5BZjUxNmEwOGItMTBmYi00MWQ1LWExY2MtNDUxMjI0OWM4M2NiXkEyXkFqcGdeQXVyMjUzOTY1NTc@._V1_QL75_UX140_CR0,1,140,207_.jpg",2000,2h 34m,8.1 (254K),"An amateur dog fighter, a supermodel, and a derelict assassin, all separately struggling to find love, find their lives transformed by a devastating car wreck in Mexico City."
241,242. The Iron Giant,"https://m.media-amazon.com/images/M/MV5BYzBjZTNkMzQtZmNkOC00Yzk0LTljMjktZjk3YWVlZjY3NTk2XkEyXkFqcGdeQXVyMTUzMDUzNTI3._V1_QL75_UX140_CR0,0,140,207_.jpg",1999,1h 26m,8.1 (230K),A young boy befriends a giant robot from outer space that a paranoid government agent wants to destroy.
242,243. Rebecca,"https://m.media-amazon.com/images/M/MV5BOGVmYmZiYTItNjUyNy00NzE4LTlhYjctMWEwMzYxYzEyMjNiXkEyXkFqcGc@._V1_QL75_UX140_CR0,0,140,207_.jpg",1940,2h 10m,8.1 (148K),A self-conscious woman juggles adjusting to her new role as an aristocrat's wife and avoiding being intimidated by his first wife's spectral presence.
243,244. Cool Hand Luke,"https://m.media-amazon.com/images/M/MV5BNjcwNTQ3Y2EtMjdmZi00ODBhLWFhNzQtOTc3MWU5NTZlMDViXkEyXkFqcGdeQXVyMjUzOTY1NTc@._V1_QL75_UX140_CR0,4,140,207_.jpg",1967,2h 7m,8.1 (190K),"A laid-back Southern man is sentenced to two years in a rural prison, but refuses to conform."
244,245. The Help,"https://m.media-amazon.com/images/M/MV5BMTM5OTMyMjIxOV5BMl5BanBnXkFtZTcwNzU4MjIwNQ@@._V1_QL75_UX140_CR0,0,140,207_.jpg",2011,2h 26m,8.1 (496K),"An aspiring author during the civil rights movement of the 1960s decides to write a book detailing the African American maids' point of view on the white families for which they work, and the hardships they go through on a daily basis."
245,246. It Happened One Night,"https://m.media-amazon.com/images/M/MV5BMDg5MmEwZjItODllOS00Yjc4LTk3NzItZWY4ODFlODQzZjJlXkEyXkFqcGdeQXVyNjc5NjEzNA@@._V1_QL75_UX140_CR0,1,140,207_.jpg",1934,1h 45m,8.1 (113K),A rogue reporter trailing a runaway heiress for a big story joins her on a bus heading from Florida to New York and they end up stuck with each other when the bus leaves them behind at one of the stops along the way.
246,247. Drishyam,"https://m.media-amazon.com/images/M/MV5BYmJhZmJlYTItZmZlNy00MGY0LTg0ZGMtNWFkYWU5NTA1YTNhXkEyXkFqcGdeQXVyODE5NzE3OTE@._V1_QL75_UY207_CR2,0,140,207_.jpg",2015,2h 43m,8.2 (96K),"Desperate measures are taken by a man who tries to save his family from the dark side of the law, after they commit an unexpected crime."
247,248. Aladdin,"https://m.media-amazon.com/images/M/MV5BZTg5ZTVmM2EtZjdhZC00MzBjLWEwZTYtNWIwZDczYzZkMzA4XkEyXkFqcGdeQXVyMTQxNzMzNDI@._V1_QL75_UX140_CR0,5,140,207_.jpg",1992,1h 30m,8.0 (471K),A kind-hearted street urchin and a power-hungry Grand Vizier vie for a magic lamp that has the power to make their deepest wishes come true.
248,249. Dances with Wolves,"https://m.media-amazon.com/images/M/MV5BMTY3OTI5NDczN15BMl5BanBnXkFtZTcwNDA0NDY3Mw@@._V1_QL75_UX140_CR0,1,140,207_.jpg",1990,3h 1m,8.0 (293K),"Lieutenant John Dunbar, assigned to a remote western Civil War outpost, finds himself engaging with a neighbouring Sioux settlement, causing him to question his own purpose."
249,"250. Paris, Texas","https://m.media-amazon.com/images/M/MV5BM2RjMmU3ZWItYzBlMy00ZmJkLWE5YzgtNTVkODdhOWM3NGZhXkEyXkFqcGdeQXVyNDA5Mjg5MjA@._V1_QL75_UX140_CR0,4,140,207_.jpg",1984,2h 25m,8.1 (121K),"Travis Henderson, an aimless drifter who has been missing for four years, wanders out of the desert and must reconnect with society, himself, his life, and his family."
