,Titles,Images,Years,Duration,Imdb Ratings,Descriptions
143,144. Ran,"https://m.media-amazon.com/images/M/MV5BMmU1NGYwZWYtOWExNi00ZTEyLTgwMmUtM2ZlMDVjNWM4YjVlXkEyXkFqcGdeQXVyMjUzOTY1NTc@._V1_QL75_UX140_CR0,3,140,207_.jpg",1985,2h 40m,8.2 (137K),"In Medieval Japan, an elderly warlord retires, handing over his empire to his three sons. However, he vastly underestimates how the new-found power will corrupt them and cause them to turn on each other...and him."
144,145. The Sixth Sense,"https://m.media-amazon.com/images/M/MV5BMWM4NTFhYjctNzUyNi00NGMwLTk3NTYtMDIyNTZmMzRlYmQyXkEyXkFqcGdeQXVyMTAwMzUyOTc@._V1_QL75_UY207_CR0,0,140,207_.jpg",1999,1h 47m,8.2 (1.1M),"Malcolm Crowe, a child psychologist, starts treating a young boy, Cole, who encounters dead people and convinces him to help them. In turn, Cole helps Malcolm reconcile with his estranged wife."
145,146. Pan's Labyrinth,"https://m.media-amazon.com/images/M/MV5BYzFjMThiMGItOWRlMC00MDI4LThmOGUtYTNlZGZiYWI1YjMyXkEyXkFqcGdeQXVyMjUzOTY1NTc@._V1_QL75_UX140_CR0,1,140,207_.jpg",2006,1h 58m,8.2 (706K),"In the Falangist Spain of 1944, the bookish young stepdaughter of a sadistic army officer escapes into an eerie but captivating fantasy world."
146,147. Unforgiven,"https://m.media-amazon.com/images/M/MV5BODM3YWY4NmQtN2Y3Ni00OTg0LWFhZGQtZWE3ZWY4MTJlOWU4XkEyXkFqcGdeQXVyNjU0OTQ0OTY@._V1_QL75_UX140_CR0,1,140,207_.jpg",1992,2h 10m,8.2 (439K),"Retired Old West gunslinger William Munny reluctantly takes on one last job, with the help of his old partner Ned Logan and a young man, The ""Schofield Kid."""
147,148. No Country for Old Men,"https://m.media-amazon.com/images/M/MV5BMjA5Njk3MjM4OV5BMl5BanBnXkFtZTcwMTc5MTE1MQ@@._V1_QL75_UY207_CR1,0,140,207_.jpg",2007,2h 2m,8.2 (1.1M),Violence and mayhem ensue after a hunter stumbles upon the aftermath of a drug deal gone wrong and over two million dollars in cash near the Rio Grande.
148,149. A Beautiful Mind,"https://m.media-amazon.com/images/M/MV5BMzcwYWFkYzktZjAzNC00OGY1LWI4YTgtNzc5MzVjMDVmNjY0XkEyXkFqcGdeQXVyMTQxNzMzNDI@._V1_QL75_UX140_CR0,0,140,207_.jpg",2001,2h 15m,8.2 (993K),"A mathematical genius, John Nash made an astonishing discovery early in his career and stood on the brink of international acclaim. But the handsome and arrogant Nash soon found himself on a harrowing journey of self-discovery."
149,150. The Thing,"https://m.media-amazon.com/images/M/MV5BNGViZWZmM2EtNGYzZi00ZDAyLTk3ODMtNzIyZTBjN2Y1NmM1XkEyXkFqcGdeQXVyNTAyODkwOQ@@._V1_QL75_UX140_CR0,1,140,207_.jpg",1982,1h 49m,8.2 (471K),A research team in Antarctica is hunted by a shape-shifting alien that assumes the appearance of its victims.
150,151. Kill Bill: Vol. 1,"https://m.media-amazon.com/images/M/MV5BNzM3NDFhYTAtYmU5Mi00NGRmLTljYjgtMDkyODQ4MjNkMGY2XkEyXkFqcGdeQXVyNzkwMjQ5NzM@._V1_QL75_UX140_CR0,1,140,207_.jpg",2003,1h 51m,8.2 (1.2M),"After awakening from a four-year coma, a former assassin wreaks vengeance on the team of assassins who betrayed her."
151,152. The Treasure of the Sierra Madre,"https://m.media-amazon.com/images/M/MV5BOTJlZWMxYzEtMjlkMS00ODE0LThlM2ItMDI3NGQ2YjhmMzkxXkEyXkFqcGdeQXVyMDI2NDg0NQ@@._V1_QL75_UX140_CR0,2,140,207_.jpg",1948,2h 6m,8.2 (133K),Two down-on-their-luck Americans searching for work in 1920s Mexico convince an old prospector to help them mine for gold in the Sierra Madre Mountains.
152,153. Yojimbo,"https://m.media-amazon.com/images/M/MV5BZThiZjAzZjgtNDU3MC00YThhLThjYWUtZGRkYjc2ZWZlOTVjXkEyXkFqcGdeQXVyNTA4NzY1MzY@._V1_QL75_UX140_CR0,1,140,207_.jpg",1961,1h 50m,8.2 (132K),A crafty ronin comes to a town divided by two criminal gangs and decides to play them against each other to free the town.
153,154. Monty Python and the Holy Grail,"https://m.media-amazon.com/images/M/MV5BN2IyNTE4YzUtZWU0Mi00MGIwLTgyMmQtMzQ4YzQxYWNlYWE2XkEyXkFqcGdeQXVyNjU0OTQ0OTY@._V1_QL75_UX140_CR0,1,140,207_.jpg",1975,1h 31m,8.2 (573K),"King Arthur and his Knights of the Round Table embark on a surreal, low-budget search for the Holy Grail, encountering many, very silly obstacles."
154,155. The Great Escape,"https://m.media-amazon.com/images/M/MV5BNzA2NmYxMWUtNzBlMC00MWM2LTkwNmQtYTFlZjQwODNhOWE0XkEyXkFqcGdeQXVyNTIzOTk5ODM@._V1_QL75_UX140_CR0,6,140,207_.jpg",1963,2h 52m,8.2 (260K),Allied prisoners of war plan for several hundred of their number to escape from a German camp during World War II.
155,156. Finding Nemo,"https://m.media-amazon.com/images/M/MV5BYWE0MzUzNDctNTFiYS00YzY3LWEzYWMtMDQyMWE5OTMxOTBiXkEyXkFqcGdeQXVyNjAwNDUxODI@._V1_QL75_UY207_CR1,0,140,207_.jpg",2003,1h 40m,8.2 (1.1M),"After his son is captured in the Great Barrier Reef and taken to Sydney, a timid clownfish sets out on a journey to bring him home."
156,157. Prisoners,"https://m.media-amazon.com/images/M/MV5BMTg0NTIzMjQ1NV5BMl5BanBnXkFtZTcwNDc3MzM5OQ@@._V1_QL75_UY207_CR0,0,140,207_.jpg",2013,2h 33m,8.2 (818K),"When Keller Dover's daughter and her friend go missing, he takes matters into his own hands as the police pursue multiple leads and the pressure mounts."
157,158. Howl's Moving Castle,"https://m.media-amazon.com/images/M/MV5BMTY1OTg0MjE3MV5BMl5BanBnXkFtZTcwNTUxMTkyMQ@@._V1_QL75_UX140_CR0,0,140,207_.jpg",2004,1h 59m,8.2 (455K),"When an unconfident young woman is cursed with an old body by a spiteful witch, her only chance of breaking the spell lies with a self-indulgent yet insecure young wizard and his companions in his legged, walking castle."
158,159. Rashomon,"https://m.media-amazon.com/images/M/MV5BMjEzMzA4NDE2OF5BMl5BanBnXkFtZTcwNTc5MDI2NQ@@._V1_QL75_UX140_CR0,0,140,207_.jpg",1950,1h 28m,8.2 (182K),"The rape of a bride and the murder of her samurai husband are recalled from the perspectives of a bandit, the bride, the samurai's ghost and a woodcutter."
159,160. The Elephant Man,"https://m.media-amazon.com/images/M/MV5BMDVjNjIwOGItNDE3Ny00OThjLWE0NzQtZTU3YjMzZTZjMzhkXkEyXkFqcGdeQXVyMTQxNzMzNDI@._V1_QL75_UX140_CR0,1,140,207_.jpg",1980,2h 4m,8.2 (260K),"A Victorian surgeon rescues a heavily disfigured man who is mistreated while scraping a living as a side-show freak. Behind his monstrous façade, there is revealed a person of kindness, intelligence and sophistication."
160,161. Dial M for Murder,"https://m.media-amazon.com/images/M/MV5BOWIwODIxYWItZDI4MS00YzhhLWE3MmYtMzlhZDIwOTMzZmE5L2ltYWdlXkEyXkFqcGdeQXVyNjc1NTYyMjg@._V1_QL75_UX140_CR0,1,140,207_.jpg",1954,1h 45m,8.2 (190K),A former tennis star arranges the murder of his adulterous wife.
161,162. Chinatown,"https://m.media-amazon.com/images/M/MV5BMjJkMDZhYzItZTFhMi00ZGI4LThlNTAtZDNlYmEwNjFkNDYzXkEyXkFqcGdeQXVyMjUzOTY1NTc@._V1_QL75_UX140_CR0,2,140,207_.jpg",1974,2h 10m,8.1 (352K),"A private detective hired to expose an adulterer in 1930s Los Angeles finds himself caught up in a web of deceit, corruption, and murder."
162,163. Gone with the Wind,"https://m.media-amazon.com/images/M/MV5BYjUyZWZkM2UtMzYxYy00ZmQ3LWFmZTQtOGE2YjBkNjA3YWZlXkEyXkFqcGdeQXVyNzkwMjQ5NzM@._V1_QL75_UX140_CR0,3,140,207_.jpg",1939,3h 58m,8.2 (336K),A sheltered and manipulative Southern belle and a roguish profiteer face off in a turbulent romance as the society around them crumbles with the end of slavery and is rebuilt during the Civil War and Reconstruction periods.
163,"164. Lock, Stock and Two Smoking Barrels","https://m.media-amazon.com/images/M/MV5BMTAyN2JmZmEtNjAyMy00NzYwLThmY2MtYWQ3OGNhNjExMmM4XkEyXkFqcGdeQXVyNDk3NzU2MTQ@._V1_QL75_UX140_CR0,1,140,207_.jpg",1998,1h 47m,8.1 (619K),"Eddy persuades his three pals to pool money for a vital poker game against a powerful local mobster, Hatchet Harry. Eddy loses, after which Harry gives him a week to pay back 500,000 pounds."
164,165. V for Vendetta,"https://m.media-amazon.com/images/M/MV5BOTI5ODc3NzExNV5BMl5BanBnXkFtZTcwNzYxNzQzMw@@._V1_QL75_UX140_CR0,0,140,207_.jpg",2005,2h 12m,8.2 (1.2M),"In a future British dystopian society, a shadowy freedom fighter, known only by the alias of ""V"", plots to overthrow the tyrannical government - with the help of a young woman."
165,166. The Secret in Their Eyes,"https://m.media-amazon.com/images/M/MV5BMTgwNTI3OTczOV5BMl5BanBnXkFtZTcwMTM3MTUyMw@@._V1_QL75_UY207_CR0,0,140,207_.jpg",2009,2h 9m,8.2 (224K),A retired legal counselor writes a novel hoping to find closure for one of his past unresolved homicide cases and for his unreciprocated love with his superior - both of which still haunt him decades later.
166,167. Inside Out,"https://m.media-amazon.com/images/M/MV5BOTgxMDQwMDk0OF5BMl5BanBnXkFtZTgwNjU5OTg2NDE@._V1_QL75_UX140_CR0,0,140,207_.jpg",2015,1h 35m,8.1 (803K),"After young Riley is uprooted from her Midwest life and moved to San Francisco, her emotions - Joy, Fear, Anger, Disgust and Sadness - conflict on how best to navigate a new city, house, and school."
167,168. Raging Bull,"https://m.media-amazon.com/images/M/MV5BYjRmODkzNDItMTNhNi00YjJlLTg0ZjAtODlhZTM0YzgzYThlXkEyXkFqcGdeQXVyNzQ1ODk3MTQ@._V1_QL75_UY207_CR1,0,140,207_.jpg",1980,2h 9m,8.1 (382K),"The life of boxer Jake LaMotta, whose violence and temper that led him to the top in the ring destroyed his life outside of it."
168,"169. Three Billboards Outside Ebbing, Missouri","https://m.media-amazon.com/images/M/MV5BMjI0ODcxNzM1N15BMl5BanBnXkFtZTgwMzIwMTEwNDI@._V1_QL75_UX140_CR0,0,140,207_.jpg",2017,1h 55m,8.1 (559K),A mother personally challenges the local authorities to solve her daughter's murder when they fail to catch the culprit.
169,170. Trainspotting,"https://m.media-amazon.com/images/M/MV5BMzA5Zjc3ZTMtMmU5YS00YTMwLWI4MWUtYTU0YTVmNjVmODZhXkEyXkFqcGdeQXVyNjU0OTQ0OTY@._V1_QL75_UX140_CR0,0,140,207_.jpg",1996,1h 33m,8.1 (729K),"Renton, deeply immersed in the Edinburgh drug scene, tries to clean up and get out despite the allure of drugs and the influence of friends."
170,171. The Bridge on the River Kwai,"https://m.media-amazon.com/images/M/MV5BOGY5NmNlMmQtYzRlYy00NGQ5LWFkYjYtNzExZmQyMTg0ZDA0XkEyXkFqcGdeQXVyNDIzMzcwNjc@._V1_QL75_UX140_CR0,5,140,207_.jpg",1957,2h 41m,8.1 (235K),"British POWs are forced to build a railway bridge across the river Kwai for their Japanese captors in occupied Burma, not knowing that the allied forces are planning a daring commando raid through the jungle to destroy it."
171,172. Klaus,"https://m.media-amazon.com/images/M/MV5BMWYwOThjM2ItZGYxNy00NTQwLWFlZWEtM2MzM2Q5MmY3NDU5XkEyXkFqcGdeQXVyMTkxNjUyNQ@@._V1_QL75_UX140_CR0,0,140,207_.jpg",2019,1h 36m,8.2 (192K),"A simple act of kindness always sparks another, even in a frozen, faraway place. When Smeerensburg's new postman, Jesper, befriends toymaker Klaus, their gifts melt an age-old feud and deliver a sleigh full of holiday traditions."
172,173. Fargo,"https://m.media-amazon.com/images/M/MV5BNDJiZDgyZjctYmRjMS00ZjdkLTkwMTEtNGU1NDg3NDQ0Yzk1XkEyXkFqcGdeQXVyNzkwMjQ5NzM@._V1_QL75_UY207_CR0,0,140,207_.jpg",1996,1h 38m,8.1 (731K),Minnesota car salesman Jerry Lundegaard's inept crime falls apart due to his and his henchmen's bungling and the persistent police work of the quite pregnant Marge Gunderson.
173,174. Catch Me If You Can,"https://m.media-amazon.com/images/M/MV5BMTY5MzYzNjc5NV5BMl5BanBnXkFtZTYwNTUyNTc2._V1_QL75_UX140_CR0,0,140,207_.jpg",2002,2h 21m,8.1 (1.1M),"Barely 17 yet, Frank is a skilled forger who has passed as a doctor, lawyer and pilot. FBI agent Carl becomes obsessed with tracking down the con man, who only revels in the pursuit."
174,175. Spider-Man: No Way Home,"https://m.media-amazon.com/images/M/MV5BZWMyYzFjYTYtNTRjYi00OGExLWE2YzgtOGRmYjAxZTU3NzBiXkEyXkFqcGdeQXVyMzQ0MzA0NTM@._V1_QL75_UX140_CR0,0,140,207_.jpg",2021,2h 28m,8.2 (890K),"With Spider-Man's identity now revealed, Peter asks Doctor Strange for help. When a spell goes wrong, dangerous foes from other worlds start to appear, forcing Peter to discover what it truly means to be Spider-Man."
175,176. Warrior,"https://m.media-amazon.com/images/M/MV5BMTk4ODk5MTMyNV5BMl5BanBnXkFtZTcwMDMyNTg0Ng@@._V1_QL75_UX140_CR0,4,140,207_.jpg",2011,2h 20m,8.1 (500K),"The youngest son of an alcoholic former boxer returns home, where he's trained by his father for competition in a mixed martial arts tournament - a path that puts the fighter on a collision course with his estranged, older brother."
176,177. Gran Torino,"https://m.media-amazon.com/images/M/MV5BMTc5NTk2OTU1Nl5BMl5BanBnXkFtZTcwMDc3NjAwMg@@._V1_QL75_UY207_CR0,0,140,207_.jpg",2008,1h 56m,8.1 (819K),"After a Hmong teenager tries to steal his prized 1972 Gran Torino, a disgruntled, prejudiced Korean War veteran seeks to redeem both the boy and himself."
177,178. Harry Potter and the Deathly Hallows: Part 2,"https://m.media-amazon.com/images/M/MV5BMGVmMWNiMDktYjQ0Mi00MWIxLTk0N2UtN2ZlYTdkN2IzNDNlXkEyXkFqcGdeQXVyODE5NzE3OTE@._V1_QL75_UX140_CR0,1,140,207_.jpg",2011,2h 10m,8.1 (955K),"Harry, Ron, and Hermione search for Voldemort's remaining Horcruxes in their effort to destroy the Dark Lord as the final battle rages on at Hogwarts."
178,179. My Neighbor Totoro,"https://m.media-amazon.com/images/M/MV5BYzJjMTYyMjQtZDI0My00ZjE2LTkyNGYtOTllNGQxNDMyZjE0XkEyXkFqcGdeQXVyMTMxODk2OTU@._V1_QL75_UY207_CR4,0,140,207_.jpg",1988,1h 26m,8.1 (384K),"When two girls move to the country to be near their ailing mother, they have adventures with the wondrous forest spirits who live nearby."
179,180. Million Dollar Baby,"https://m.media-amazon.com/images/M/MV5BMTkxNzA1NDQxOV5BMl5BanBnXkFtZTcwNTkyMTIzMw@@._V1_QL75_UY207_CR0,0,140,207_.jpg",2004,2h 12m,8.1 (725K),"Frankie, an ill-tempered old coach, reluctantly agrees to train aspiring boxer Maggie. Impressed with her determination and talent, he helps her become the best and the two soon form a close bond."
180,181. Children of Heaven,"https://m.media-amazon.com/images/M/MV5BZTYwZWQ4ZTQtZWU0MS00N2YwLWEzMDItZWFkZWY0MWVjODVhXkEyXkFqcGdeQXVyNjU0OTQ0OTY@._V1_QL75_UX140_CR0,4,140,207_.jpg",1997,1h 29m,8.2 (81K),"After a boy loses his sister's pair of shoes, he goes on a series of adventures in order to find them. When he can't, he tries a new way to ""win"" a new pair."
181,182. 12 Years a Slave,"https://m.media-amazon.com/images/M/MV5BMjExMTEzODkyN15BMl5BanBnXkFtZTcwNTU4NTc4OQ@@._V1_QL75_UX140_CR0,0,140,207_.jpg",2013,2h 14m,8.1 (745K),"In the antebellum United States, Solomon Northup, a free Black man from upstate New York, is abducted and sold into slavery."
182,183. Ben-Hur,"https://m.media-amazon.com/images/M/MV5BNjgxY2JiZDYtZmMwOC00ZmJjLWJmODUtMTNmNWNmYWI5ODkwL2ltYWdlL2ltYWdlXkEyXkFqcGdeQXVyNjc1NTYyMjg@._V1_QL75_UX140_CR0,2,140,207_.jpg",1959,3h 32m,8.1 (255K),"After a Jewish prince is betrayed and sent into slavery by a Roman friend in 1st-century Jerusalem, he regains his freedom and comes back for revenge."
183,184. Blade Runner,"https://m.media-amazon.com/images/M/MV5BNzQzMzJhZTEtOWM4NS00MTdhLTg0YjgtMjM4MDRkZjUwZDBlXkEyXkFqcGdeQXVyNjU0OTQ0OTY@._V1_QL75_UX140_CR0,0,140,207_.jpg",1982,1h 57m,8.1 (827K),A blade runner must pursue and terminate four replicants who stole a ship in space and have returned to Earth to find their creator.
184,185. Before Sunrise,"https://m.media-amazon.com/images/M/MV5BZDdiZTAwYzAtMDI3Ni00OTRjLTkzN2UtMGE3MDMyZmU4NTU4XkEyXkFqcGdeQXVyNjU0OTQ0OTY@._V1_QL75_UX140_CR0,0,140,207_.jpg",1995,1h 41m,8.1 (342K),"A young man and woman meet on a train in Europe, and wind up spending one evening together in Vienna. Unfortunately, both know that this will probably be their only night together."
185,186. Barry Lyndon,"https://m.media-amazon.com/images/M/MV5BNmY0MWY2NDctZDdmMi00MjA1LTk0ZTQtZDMyZTQ1NTNlYzVjXkEyXkFqcGdeQXVyMjUzOTY1NTc@._V1_QL75_UX140_CR0,3,140,207_.jpg",1975,3h 5m,8.1 (184K),An Irish rogue wins the heart of a rich widow and assumes her dead husband's aristocratic position in 18th-century England.
186,187. The Grand Budapest Hotel,"https://m.media-amazon.com/images/M/MV5BMzM5NjUxOTEyMl5BMl5BanBnXkFtZTgwNjEyMDM0MDE@._V1_QL75_UX140_CR0,0,140,207_.jpg",2014,1h 39m,8.1 (892K),"A writer encounters the owner of an aging high-class hotel, who tells him of his early years serving as a lobby boy in the hotel's glorious years under an exceptional concierge."
187,188. Mad Max: Fury Road,"https://m.media-amazon.com/images/M/MV5BN2EwM2I5OWMtMGQyMi00Zjg1LWJkNTctZTdjYTA4OGUwZjMyXkEyXkFqcGdeQXVyMTMxODk2OTU@._V1_QL75_UX140_CR0,0,140,207_.jpg",2015,2h,8.1 (1.1M),"In a post-apocalyptic wasteland, a woman rebels against a tyrannical ruler in search for her homeland with the aid of a group of female prisoners, a psychotic worshipper and a drifter named Max."
188,189. Gone Girl,"https://m.media-amazon.com/images/M/MV5BMTk0MDQ3MzAzOV5BMl5BanBnXkFtZTgwNzU1NzE3MjE@._V1_QL75_UY207_CR0,0,140,207_.jpg",2014,2h 29m,8.1 (1.1M),"With his wife's disappearance having become the focus of an intense media circus, a man sees the spotlight turned on him when it's suspected that he may not be innocent."
189,190. Hacksaw Ridge,"https://m.media-amazon.com/images/M/MV5BMjQ1NjM3MTUxNV5BMl5BanBnXkFtZTgwMDc5MTY5OTE@._V1_QL75_UX140_CR0,4,140,207_.jpg",2016,2h 19m,8.1 (601K),"World War II American Army Medic Desmond T. Doss, serving during the Battle of Okinawa, refuses to kill people and becomes the first man in American history to receive the Medal of Honor without firing a shot."
190,191. Dead Poets Society,"https://m.media-amazon.com/images/M/MV5BOGYwYWNjMzgtNGU4ZC00NWQ2LWEwZjUtMzE1Zjc3NjY3YTU1XkEyXkFqcGdeQXVyMTQxNzMzNDI@._V1_QL75_UY207_CR0,0,140,207_.jpg",1989,2h 8m,8.1 (552K),"Maverick teacher John Keating returns in 1959 to the prestigious New England boys' boarding school where he was once a star student, using poetry to embolden his pupils to new heights of self-expression."
191,192. The Gold Rush,"https://m.media-amazon.com/images/M/MV5BMDA3NmE2OTYtZWQ1Zi00OGI2LTk5NjctNThhNGJjYTI1NzRlXkEyXkFqcGdeQXVyNjc5NjEzNA@@._V1_QL75_UX140_CR0,0,140,207_.jpg",1925,1h 35m,8.1 (119K),"A prospector goes to the Klondike during the 1890s gold rush in hopes of making his fortune, and is smitten with a girl he sees in a dance hall."
192,193. Memories of Murder,"https://m.media-amazon.com/images/M/MV5BOGViNTg4YTktYTQ2Ni00MTU0LTk2NWUtMTI4OTc1YTM0NzQ2XkEyXkFqcGdeQXVyMDM2NDM2MQ@@._V1_QL75_UX140_CR0,0,140,207_.jpg",2003,2h 12m,8.1 (220K),"In a small Korean province in 1986, two detectives struggle with the case of multiple young women being found raped and murdered by an unknown culprit."
193,194. In the Name of the Father,"https://m.media-amazon.com/images/M/MV5BMmYyOTgwYWItYmU3Ny00M2E2LTk0NWMtMDVlNmQ0MWZiMTMxXkEyXkFqcGdeQXVyNzkwMjQ5NzM@._V1_QL75_UX140_CR0,1,140,207_.jpg",1993,2h 13m,8.1 (188K),"An Irish man's coerced confession to an I.R.A. bombing he did not commit results in the imprisonment of his father as well. Meanwhile, a British lawyer fights to clear their names and free them."
194,195. Wild Tales,"https://m.media-amazon.com/images/M/MV5BNzAzMjA1ODAxOV5BMl5BanBnXkFtZTgwODg4NTQzNDE@._V1_QL75_UX140_CR0,0,140,207_.jpg",2014,2h 2m,8.1 (218K),Six short stories that explore the extremities of human behavior involving people in distress.
195,"196. Monsters, Inc.","https://m.media-amazon.com/images/M/MV5BMTY1NTI0ODUyOF5BMl5BanBnXkFtZTgwNTEyNjQ0MDE@._V1_QL75_UX140_CR0,0,140,207_.jpg",2001,1h 32m,8.1 (986K),"In order to power the city, monsters have to scare children so that they scream. However, the children are toxic to the monsters, and after a child gets through, two monsters realize things may not be what they think."
196,197. The Deer Hunter,"https://m.media-amazon.com/images/M/MV5BNDhmNTA0ZDMtYjhkNS00NzEzLWIzYTItOGNkMTVmYjE2YmI3XkEyXkFqcGdeQXVyNzkwMjQ5NzM@._V1_QL75_UY207_CR0,0,140,207_.jpg",1978,3h 3m,8.1 (364K),An in-depth examination of the ways in which the Vietnam War impacts and disrupts the lives of several friends in a small steel mill town in Pennsylvania.
197,198. The General,"https://m.media-amazon.com/images/M/MV5BYmRiMDFlYjYtOTMwYy00OGY2LWE0Y2QtYzQxOGNhZmUwNTIxXkEyXkFqcGdeQXVyNzkwMjQ5NzM@._V1_QL75_UX140_CR0,0,140,207_.jpg",1926,1h 18m,8.1 (99K),"After being rejected by the Confederate military, not realizing it was due to his crucial civilian role, an engineer must single-handedly recapture his beloved locomotive after it is seized by Union spies and return it through enemy lines."
198,199. Sherlock Jr.,"https://m.media-amazon.com/images/M/MV5BZWFhOGU5NDctY2Q3YS00Y2VlLWI1NzEtZmIwY2ZiZjY4OTA2XkEyXkFqcGdeQXVyMDI2NDg0NQ@@._V1_QL75_UX140_CR0,7,140,207_.jpg",1924,45m,8.2 (58K),"A film projectionist longs to be a detective, and puts his meagre skills to work when he is framed by a rival for stealing his girlfriend's father's pocketwatch."
199,200. On the Waterfront,"https://m.media-amazon.com/images/M/MV5BY2I0MWFiZDMtNWQyYy00Njk5LTk3MDktZjZjNTNmZmVkYjkxXkEyXkFqcGdeQXVyNjc1NTYyMjg@._V1_QL75_UX140_CR0,2,140,207_.jpg",1954,1h 48m,8.1 (166K),"An ex-prize fighter turned New Jersey longshoreman struggles to stand up to his corrupt union bosses, including his older brother, as he starts to connect with the grieving sister of one of the syndicate's victims."
200,201. How to Train Your Dragon,"https://m.media-amazon.com/images/M/MV5BMjA5NDQyMjc2NF5BMl5BanBnXkFtZTcwMjg5ODcyMw@@._V1_QL75_UX140_CR0,0,140,207_.jpg",2010,1h 38m,8.1 (806K),"A hapless young Viking who aspires to hunt dragons becomes the unlikely friend of a young dragon himself, and learns there may be more to the creatures than he assumed."
201,202. Jaws,"https://m.media-amazon.com/images/M/MV5BMmVmODY1MzEtYTMwZC00MzNhLWFkNDMtZjAwM2EwODUxZTA5XkEyXkFqcGdeQXVyNTAyODkwOQ@@._V1_QL75_UX140_CR0,4,140,207_.jpg",1975,2h 4m,8.1 (665K),"When a killer shark unleashes chaos on a beach community off Cape Cod, it's up to a local sheriff, a marine biologist, and an old seafarer to hunt the beast down."
202,203. Mary and Max,"https://m.media-amazon.com/images/M/MV5BMDgzYjQwMDMtNGUzYi00MTRmLWIyMGMtNjE1OGZkNzY2YWIzL2ltYWdlXkEyXkFqcGdeQXVyNjU0OTQ0OTY@._V1_QL75_UY207_CR3,0,140,207_.jpg",2009,1h 32m,8.1 (188K),"In 1976 Melbourne, a lonely 8-year-old girl strikes up a correspondence with an unlikely pen pal: a severely obese 44-year-old New Yorker with Asperger's syndrome."
203,204. The Third Man,"https://m.media-amazon.com/images/M/MV5BYjE2OTdhMWUtOGJlMy00ZDViLWIzZjgtYjZkZGZmMDZjYmEyXkEyXkFqcGdeQXVyNzkwMjQ5NzM@._V1_QL75_UX140_CR0,1,140,207_.jpg",1949,1h 33m,8.1 (183K),"Pulp novelist Holly Martins travels to shadowy, postwar Vienna, only to find himself investigating the mysterious death of an old friend, Harry Lime."
204,205. Ratatouille,"https://m.media-amazon.com/images/M/MV5BMTMzODU0NTkxMF5BMl5BanBnXkFtZTcwMjQ4MzMzMw@@._V1_QL75_UX140_CR0,0,140,207_.jpg",2007,1h 51m,8.1 (834K),A rat who can cook makes an unusual alliance with a young kitchen worker at a famous Paris restaurant.
205,206. The Wages of Fear,"https://m.media-amazon.com/images/M/MV5BZDdkNzMwZmUtY2Q5MS00ZmM2LWJhYjItYTBjMWY0MGM4MDRjXkEyXkFqcGdeQXVyNTA4NzY1MzY@._V1_QL75_UY207_CR1,0,140,207_.jpg",1953,2h 11m,8.1 (67K),"In a decrepit South American village, four men are hired to transport an urgent nitroglycerine shipment without the equipment that would make it safe."
206,207. Wild Strawberries,"https://m.media-amazon.com/images/M/MV5BYWQxYzdhMDMtNjAyZC00NzE0LWFjYmQtYjk0YzMyYjA5NzZkXkEyXkFqcGdeQXVyMjUzOTY1NTc@._V1_QL75_UX140_CR0,3,140,207_.jpg",1957,1h 31m,8.1 (116K),"After living a life marked by coldness, an aging professor is forced to confront the emptiness of his existence."
207,208. Mr. Smith Goes to Washington,"https://m.media-amazon.com/images/M/MV5BZTYwYjYxYzgtMDE1Ni00NzU4LWJlMTEtODQ5YmJmMGJhZjI5L2ltYWdlXkEyXkFqcGdeQXVyMDI2NDg0NQ@@._V1_QL75_UX140_CR0,2,140,207_.jpg",1939,2h 9m,8.1 (122K),"A naive youth leader is appointed to fill a vacancy in the U.S. Senate. His idealistic plans promptly collide with corruption at home and subterfuge from his hero in Washington, but he tries to forge ahead despite attacks on his character."
208,209. Ford v Ferrari,"https://m.media-amazon.com/images/M/MV5BM2UwMDVmMDItM2I2Yi00NGZmLTk4ZTUtY2JjNTQ3OGQ5ZjM2XkEyXkFqcGdeQXVyMTA1OTYzOTUx._V1_QL75_UY207_CR0,0,140,207_.jpg",2019,2h 32m,8.1 (484K),American car designer Carroll Shelby and driver Ken Miles battle corporate interference and the laws of physics to build a revolutionary race car for Ford in order to defeat Ferrari at the 24 Hours of Le Mans in 1966.
209,210. Tokyo Story,"https://m.media-amazon.com/images/M/MV5BM2E1ZmZlMDQtMDgzNi00MGVmLTgwMWMtYTc1MjkzOWJmOGIxXkEyXkFqcGdeQXVyMjgyNjk3MzE@._V1_QL75_UY207_CR3,0,140,207_.jpg",1953,2h 16m,8.1 (69K),"An old couple visit their children and grandchildren in the city, but receive little attention."
210,211. The Big Lebowski,"https://m.media-amazon.com/images/M/MV5BMzliZDk0NjctNjhlOC00MWEyLWI3OWYtNjA5ZDYxMTMzNTc5XkEyXkFqcGdeQXVyNTAyODkwOQ@@._V1_QL75_UY207_CR0,0,140,207_.jpg",1998,1h 57m,8.1 (865K),"Jeff ""The Dude"" Lebowski, mistaken for a millionaire of the same name, seeks restitution for his ruined rug and enlists his bowling buddies to help get it."
211,212. Rocky,"https://m.media-amazon.com/images/M/MV5BNTBkMjg2MjYtYTZjOS00ODQ0LTg0MDEtM2FiNmJmOGU1NGEwXkEyXkFqcGdeQXVyMjUzOTY1NTc@._V1_QL75_UX140_CR0,3,140,207_.jpg",1976,2h,8.1 (633K),A small-time Philadelphia boxer gets a supremely rare chance to fight the world heavyweight champion in a bout in which he strives to go the distance for his self-respect.
212,213. The Seventh Seal,"https://m.media-amazon.com/images/M/MV5BOWM3MmE0OGYtOGVlNC00OWE1LTk5ZTAtYmUwMDIwM2ZlNWJiXkEyXkFqcGdeQXVyMjUzOTY1NTc@._V1_QL75_UY207_CR1,0,140,207_.jpg",1957,1h 36m,8.1 (200K),"A knight returning to Sweden after the Crusades seeks answers about life, death, and the existence of God as he plays chess against the Grim Reaper during the Black Plague."
213,214. Room,"https://m.media-amazon.com/images/M/MV5BMjE4NzgzNzEwMl5BMl5BanBnXkFtZTgwMTMzMDE0NjE@._V1_QL75_UX140_CR0,0,140,207_.jpg",2015,1h 58m,8.1 (453K),"A little boy is held captive in a room with his mother since his birth, so he has never known the world outside."
