,Titles,Images,Years,Duration,Imdb Ratings,Descriptions
71,72. Coco,"https://m.media-amazon.com/images/M/MV5BYjQ5NjM0Y2YtNjZkNC00ZDhkLWJjMWItN2QyNzFkMDE3ZjAxXkEyXkFqcGdeQXVyODIxMzk5NjA@._V1_QL75_UY207_CR3,0,140,207_.jpg",2017,1h 45m,8.4 (599K),"Aspiring musician Miguel, confronted with his family's ancestral ban on music, enters the Land of the Dead to find his great-great-grandfather, a legendary singer."
72,73. Dr. Strangelove or: How I Learned to Stop Worrying and Love the Bomb,"https://m.media-amazon.com/images/M/MV5BZWI3ZTMxNjctMjdlNS00NmUwLWFiM2YtZDUyY2I3N2MxYTE0XkEyXkFqcGdeQXVyNzkwMjQ5NzM@._V1_QL75_UX140_CR0,5,140,207_.jpg",1964,1h 35m,8.3 (521K),"An unhinged American general orders a bombing attack on the Soviet Union, triggering a path to nuclear holocaust that a war room full of politicians and generals frantically tries to stop."
73,74. Amadeus,"https://m.media-amazon.com/images/M/MV5BNWJlNzUzNGMtYTAwMS00ZjI2LWFmNWQtODcxNWUxODA5YmU1XkEyXkFqcGdeQXVyNTIzOTk5ODM@._V1_QL75_UX140_CR0,5,140,207_.jpg",1984,2h 40m,8.4 (431K),"The life, success and troubles of Wolfgang Amadeus Mozart, as told by Antonio Salieri, the contemporaneous composer who was deeply jealous of Mozart's talent and claimed to have murdered him."
74,75. Oldboy,"https://m.media-amazon.com/images/M/MV5BMTI3NTQyMzU5M15BMl5BanBnXkFtZTcwMTM2MjgyMQ@@._V1_QL75_UX140_CR0,0,140,207_.jpg",2003,2h,8.3 (641K),"After being kidnapped and imprisoned for fifteen years, Oh Dae-Su is released, only to find that he must track down his captor in five days."
75,76. American Beauty,"https://m.media-amazon.com/images/M/MV5BNTBmZWJkNjctNDhiNC00MGE2LWEwOTctZTk5OGVhMWMyNmVhXkEyXkFqcGdeQXVyMTMxODk2OTU@._V1_QL75_UX140_CR0,0,140,207_.jpg",1999,2h 2m,8.3 (1.2M),A sexually frustrated suburban father has a mid-life crisis after becoming infatuated with his daughter's best friend.
76,77. Toy Story,"https://m.media-amazon.com/images/M/MV5BMDU2ZWJlMjktMTRhMy00ZTA5LWEzNDgtYmNmZTEwZTViZWJkXkEyXkFqcGdeQXVyNDQ2OTk4MzI@._V1_QL75_UX140_CR0,1,140,207_.jpg",1995,1h 21m,8.3 (1.1M),A cowboy doll is profoundly threatened and jealous when a new spaceman action figure supplants him as top toy in a boy's bedroom.
77,78. Avengers: Endgame,"https://m.media-amazon.com/images/M/MV5BMTc5MDE2ODcwNV5BMl5BanBnXkFtZTgwMzI2NzQ2NzM@._V1_QL75_UX140_CR0,0,140,207_.jpg",2019,3h 1m,8.4 (1.3M),"After the devastating events of Avengers: Infinity War (2018), the universe is in ruins. With the help of remaining allies, the Avengers assemble once more in order to reverse Thanos' actions and restore balance to the universe."
78,79. Das Boot,"https://m.media-amazon.com/images/M/MV5BNDBjMWUxNTUtNjZiNi00YzJhLTgzNzUtMTRiY2FkZmMzYTNjXkEyXkFqcGdeQXVyMTUzMDUzNTI3._V1_QL75_UX140_CR0,2,140,207_.jpg",1981,2h 29m,8.4 (266K),A German U-boat stalks the frigid waters of the North Atlantic as its young crew experience the sheer terror and claustrophobic life of a submariner in World War II.
79,80. Braveheart,"https://m.media-amazon.com/images/M/MV5BMzkzMmU0YTYtOWM3My00YzBmLWI0YzctOGYyNTkwMWE5MTJkXkEyXkFqcGdeQXVyNzkwMjQ5NzM@._V1_QL75_UY207_CR0,0,140,207_.jpg",1995,2h 58m,8.3 (1.1M),Scottish warrior William Wallace leads his countrymen in a rebellion to free his homeland from the tyranny of King Edward I of England.
80,81. Good Will Hunting,"https://m.media-amazon.com/images/M/MV5BOTI0MzcxMTYtZDVkMy00NjY1LTgyMTYtZmUxN2M3NmQ2NWJhXkEyXkFqcGdeQXVyMTQxNzMzNDI@._V1_QL75_UX140_CR0,3,140,207_.jpg",1997,2h 6m,8.3 (1.1M),"Will Hunting, a janitor at MIT, has a gift for mathematics, but needs help from a psychologist to find direction in his life."
81,82. Princess Mononoke,"https://m.media-amazon.com/images/M/MV5BNjM3NGExNDctYmU0Yy00MTJjLThlNTItMjM4NDBjMGRiMmE5XkEyXkFqcGdeQXVyMTUzMDUzNTI3._V1_QL75_UX140_CR0,0,140,207_.jpg",1997,2h 14m,8.3 (437K),"On a journey to find the cure for a Tatarigami's curse, Ashitaka finds himself in the middle of a war between the forest gods and Tatara, a mining colony. In this quest he also meets San, the Mononoke Hime."
82,83. Joker,"https://m.media-amazon.com/images/M/MV5BNGVjNWI4ZGUtNzE0MS00YTJmLWE0ZDctN2ZiYTk2YmI3NTYyXkEyXkFqcGdeQXVyMTkxNjUyNQ@@._V1_QL75_UX140_CR0,0,140,207_.jpg",2019,2h 2m,8.4 (1.5M),"Arthur Fleck, a party clown and a failed stand-up comedian, leads an impoverished life with his ailing mother. However, when society shuns him and brands him as a freak, he decides to embrace the life of crime and chaos in Gotham City."
83,84. Your Name.,"https://m.media-amazon.com/images/M/MV5BODRmZDVmNzUtZDA4ZC00NjhkLWI2M2UtN2M0ZDIzNDcxYThjL2ltYWdlXkEyXkFqcGdeQXVyNTk0MzMzODA@._V1_QL75_UX140_CR0,0,140,207_.jpg",2016,1h 46m,8.4 (326K),"Two teenagers share a profound, magical connection upon discovering they are swapping bodies. Things manage to become even more complicated when the boy and girl decide to meet in person."
84,85. High and Low,"https://m.media-amazon.com/images/M/MV5BZGQ1NWZlYjctNDJmOS00MmU2LTg1ODItNmZiM2ZkNzJhNDI0XkEyXkFqcGdeQXVyNjc1NTYyMjg@._V1_QL75_UY207_CR3,0,140,207_.jpg",1963,2h 23m,8.4 (54K),An executive of a Yokohama shoe company becomes a victim of extortion when his chauffeur's son is kidnapped by mistake and held for ransom.
85,86. Once Upon a Time in America,"https://m.media-amazon.com/images/M/MV5BMmQzZjdmZDAtOGE2Yy00MmUwLTljYzgtZTMwMjk3ZDdiOWUyXkEyXkFqcGdeQXVyNjc5NjEzNA@@._V1_QL75_UX140_CR0,1,140,207_.jpg",1984,3h 49m,8.3 (380K),"A former Prohibition-era Jewish gangster returns to the Lower East Side of Manhattan 35 years later, where he must once again confront the ghosts and regrets of his old life."
86,87. 3 Idiots,"https://m.media-amazon.com/images/M/MV5BNTkyOGVjMGEtNmQzZi00NzFlLTlhOWQtODYyMDc2ZGJmYzFhXkEyXkFqcGdeQXVyNjU0OTQ0OTY@._V1_QL75_UY207_CR2,0,140,207_.jpg",2009,2h 50m,8.4 (438K),"Two friends are searching for their long lost companion. They revisit their college days and recall the memories of their friend who inspired them to think differently, even as the rest of the world called them ""idiots""."
87,88. Singin' in the Rain,"https://m.media-amazon.com/images/M/MV5BZDRjNGViMjQtOThlMi00MTA3LThkYzQtNzJkYjBkMGE0YzE1XkEyXkFqcGdeQXVyNDYyMDk5MTU@._V1_QL75_UY207_CR1,0,140,207_.jpg",1952,1h 43m,8.3 (262K),A silent film star falls for a chorus girl just as he and his delusionally jealous screen partner are trying to make the difficult transition to talking pictures in 1920s Hollywood.
88,89. Capernaum,"https://m.media-amazon.com/images/M/MV5BMmExNzU2ZWMtYzUwYi00YmM2LTkxZTQtNmVhNjY0NTMyMWI2XkEyXkFqcGdeQXVyMTMxODk2OTU@._V1_QL75_UY207_CR1,0,140,207_.jpg",2018,2h 6m,8.4 (107K),"While serving a five-year sentence for a violent crime, a 12-year-old boy sues his parents for neglect."
89,90. Come and See,"https://m.media-amazon.com/images/M/MV5BODM4Njg0NTAtYjI5Ny00ZjAxLTkwNmItZTMxMWU5M2U3M2RjXkEyXkFqcGdeQXVyNzkwMjQ5NzM@._V1_QL75_UX140_CR0,4,140,207_.jpg",1985,2h 22m,8.4 (99K),"After finding an old rifle, a young boy joins the Soviet resistance movement against ruthless German forces and experiences the horrors of World War II."
90,91. Requiem for a Dream,"https://m.media-amazon.com/images/M/MV5BOTdiNzJlOWUtNWMwNS00NmFlLWI0YTEtZmI3YjIzZWUyY2Y3XkEyXkFqcGdeQXVyNjU0OTQ0OTY@._V1_QL75_UX140_CR0,1,140,207_.jpg",2000,1h 42m,8.3 (904K),The drug-induced utopias of four Coney Island people are shattered when their addictions run deep..
91,92. Toy Story 3,"https://m.media-amazon.com/images/M/MV5BMTgxOTY4Mjc0MF5BMl5BanBnXkFtZTcwNTA4MDQyMw@@._V1_QL75_UY207_CR3,0,140,207_.jpg",2010,1h 43m,8.3 (898K),"The toys are mistakenly delivered to a day-care center instead of the attic right before Andy leaves for college, and it's up to Woody to convince the other toys that they weren't abandoned and to return home."
92,93. Star Wars: Episode VI - Return of the Jedi,"https://m.media-amazon.com/images/M/MV5BOWZlMjFiYzgtMTUzNC00Y2IzLTk1NTMtZmNhMTczNTk0ODk1XkEyXkFqcGdeQXVyNTAyODkwOQ@@._V1_QL75_UX140_CR0,5,140,207_.jpg",1983,2h 11m,8.3 (1.1M),"After rescuing Han Solo from Jabba the Hutt, the Rebel Alliance attempt to destroy the second Death Star, while Luke struggles to help Darth Vader back from the dark side."
93,94. Eternal Sunshine of the Spotless Mind,"https://m.media-amazon.com/images/M/MV5BMTY4NzcwODg3Nl5BMl5BanBnXkFtZTcwNTEwOTMyMw@@._V1_QL75_UX140_CR0,0,140,207_.jpg",2004,1h 48m,8.3 (1.1M),"When their relationship turns sour, a couple undergoes a medical procedure to have each other erased from their memories forever."
94,95. The Hunt,"https://m.media-amazon.com/images/M/MV5BMTg2NDg3ODg4NF5BMl5BanBnXkFtZTcwNzk3NTc3Nw@@._V1_QL75_UY207_CR3,0,140,207_.jpg",2012,1h 55m,8.3 (368K),"A teacher lives a lonely life, all the while struggling over his son's custody. His life slowly gets better as he finds love and receives good news from his son, but his new luck is about to be brutally shattered by an innocent little lie."
95,96. 2001: A Space Odyssey,"https://m.media-amazon.com/images/M/MV5BMmNlYzRiNDctZWNhMi00MzI4LThkZTctMTUzMmZkMmFmNThmXkEyXkFqcGdeQXVyNzkwMjQ5NzM@._V1_QL75_UX140_CR0,0,140,207_.jpg",1968,2h 29m,8.3 (724K),"After uncovering a mysterious artifact buried beneath the Lunar surface, a spacecraft is sent to Jupiter to find its origins: a spacecraft manned by two men and the supercomputer HAL 9000."
96,97. Reservoir Dogs,"https://m.media-amazon.com/images/M/MV5BZmExNmEwYWItYmQzOS00YjA5LTk2MjktZjEyZDE1Y2QxNjA1XkEyXkFqcGdeQXVyMTQxNzMzNDI@._V1_QL75_UX140_CR0,1,140,207_.jpg",1992,1h 39m,8.3 (1.1M),"When a simple jewelry heist goes horribly wrong, the surviving criminals begin to suspect that one of them is a police informant."
97,98. Ikiru,"https://m.media-amazon.com/images/M/MV5BYWM1YmZkNTctZDAwNy00ZTY4LWFjMTktYzU4ZjViMmU1OTJmXkEyXkFqcGdeQXVyMTA0MTM5NjI2._V1_QL75_UX140_CR0,1,140,207_.jpg",1952,2h 23m,8.3 (88K),A bureaucrat tries to find meaning in his life after he discovers he has terminal cancer.
98,99. Oppenheimer,"https://m.media-amazon.com/images/M/MV5BMDBmYTZjNjUtN2M1MS00MTQ2LTk2ODgtNzc2M2QyZGE5NTVjXkEyXkFqcGdeQXVyNzAwMjU2MTY@._V1_QL75_UX140_CR0,0,140,207_.jpg",2023,3h,8.3 (762K),The story of American scientist J. Robert Oppenheimer and his role in the development of the atomic bomb.
99,100. Lawrence of Arabia,"https://m.media-amazon.com/images/M/MV5BYWY5ZjhjNGYtZmI2Ny00ODM0LWFkNzgtZmI1YzA2N2MxMzA0XkEyXkFqcGdeQXVyNjUwNzk3NDc@._V1_QL75_UY207_CR2,0,140,207_.jpg",1962,3h 38m,8.3 (316K),"The story of T.E. Lawrence, the English officer who successfully united and led the diverse, often warring, Arab tribes during World War I in order to fight the Turks."
100,101. The Apartment,"https://m.media-amazon.com/images/M/MV5BNzkwODFjNzItMmMwNi00MTU5LWE2MzktM2M4ZDczZGM1MmViXkEyXkFqcGdeQXVyNDY2MTk1ODk@._V1_QL75_UX140_CR0,7,140,207_.jpg",1960,2h 5m,8.3 (198K),"A Manhattan insurance clerk tries to rise in his company by letting its executives use his apartment for trysts, but office politics and his own romantic hopes complicate matters."
101,102. Incendies,"https://m.media-amazon.com/images/M/MV5BMWE3MGYzZjktY2Q5Mi00Y2NiLWIyYWUtMmIyNzA3YmZlMGFhXkEyXkFqcGdeQXVyMTMxODk2OTU@._V1_QL75_UX140_CR0,1,140,207_.jpg",2010,2h 11m,8.3 (204K),Twins journey to the Middle East to discover their family history and fulfill their mother's last wishes.
102,103. North by Northwest,"https://m.media-amazon.com/images/M/MV5BZDA3NDExMTUtMDlhOC00MmQ5LWExZGUtYmI1NGVlZWI4OWNiXkEyXkFqcGdeQXVyNjc1NTYyMjg@._V1_QL75_UX140_CR0,2,140,207_.jpg",1959,2h 16m,8.3 (348K),"A New York City advertising executive goes on the run after being mistaken for a government agent by a group of foreign spies, and falls for a woman whose loyalties he begins to doubt."
103,104. Citizen Kane,"https://m.media-amazon.com/images/M/MV5BYjBiOTYxZWItMzdiZi00NjlkLWIzZTYtYmFhZjhiMTljOTdkXkEyXkFqcGdeQXVyNzkwMjQ5NzM@._V1_QL75_UX140_CR0,1,140,207_.jpg",1941,1h 59m,8.3 (468K),"Following the death of publishing tycoon Charles Foster Kane, reporters scramble to uncover the meaning of his final utterance: 'Rosebud.'"
104,105. M,"https://m.media-amazon.com/images/M/MV5BODA4ODk3OTEzMF5BMl5BanBnXkFtZTgwMTQ2ODMwMzE@._V1_QL75_UX140_CR0,1,140,207_.jpg",1931,1h 39m,8.3 (170K),"When the police in a German city are unable to catch a child-murderer, other criminals join in the manhunt."
105,106. Scarface,"https://m.media-amazon.com/images/M/MV5BNjdjNGQ4NDEtNTEwYS00MTgxLTliYzQtYzE2ZDRiZjFhZmNlXkEyXkFqcGdeQXVyNjU0OTQ0OTY@._V1_QL75_UX140_CR0,1,140,207_.jpg",1983,2h 50m,8.3 (923K),"In 1980 Miami, a determined Cuban immigrant takes over a drug cartel and succumbs to greed."
106,107. Double Indemnity,"https://m.media-amazon.com/images/M/MV5BOTdlNjgyZGUtOTczYi00MDdhLTljZmMtYTEwZmRiOWFkYjRhXkEyXkFqcGdeQXVyNDY2MTk1ODk@._V1_QL75_UX140_CR0,2,140,207_.jpg",1944,1h 47m,8.3 (168K),"A Los Angeles insurance representative lets an alluring housewife seduce him into a scheme of insurance fraud and murder that arouses the suspicion of his colleague, an insurance investigator."
107,108. Vertigo,"https://m.media-amazon.com/images/M/MV5BYTE4ODEwZDUtNDFjOC00NjAxLWEzYTQtYTI1NGVmZmFlNjdiL2ltYWdlL2ltYWdlXkEyXkFqcGdeQXVyNjc1NTYyMjg@._V1_QL75_UX140_CR0,5,140,207_.jpg",1958,2h 8m,8.3 (430K),"A former San Francisco police detective juggles wrestling with his personal demons and becoming obsessed with the hauntingly beautiful woman he has been hired to trail, who may be deeply disturbed."
108,109. Full Metal Jacket,"https://m.media-amazon.com/images/M/MV5BNzkxODk0NjEtYjc4Mi00ZDI0LTgyYjEtYzc1NDkxY2YzYTgyXkEyXkFqcGdeQXVyNzkwMjQ5NzM@._V1_QL75_UX140_CR0,1,140,207_.jpg",1987,1h 56m,8.3 (795K),A pragmatic U.S. Marine observes the dehumanizing effects the Vietnam War has on his fellow recruits from their brutal boot camp training to the bloody street fighting in Hue.
109,110. Amélie,"https://m.media-amazon.com/images/M/MV5BNDg4NjM1YjMtYmNhZC00MjM0LWFiZmYtNGY1YjA3MzZmODc5XkEyXkFqcGdeQXVyNDk3NzU2MTQ@._V1_QL75_UX140_CR0,1,140,207_.jpg",2001,2h 2m,8.3 (798K),"Despite being caught in her imaginative world, Amelie, a young waitress, decides to help people find happiness. Her quest to spread joy leads her on a journey where she finds true love."
110,111. Heat,"https://m.media-amazon.com/images/M/MV5BYjZjNTJlZGUtZTE1Ny00ZDc4LTgwYjUtMzk0NDgwYzZjYTk1XkEyXkFqcGdeQXVyNjU0OTQ0OTY@._V1_QL75_UY207_CR2,0,140,207_.jpg",1995,2h 50m,8.3 (725K),A group of high-end professional thieves start to feel the heat from the LAPD when they unknowingly leave a verbal clue at their latest heist.
111,112. Up,"https://m.media-amazon.com/images/M/MV5BYjBkM2RjMzItM2M3Ni00N2NjLWE3NzMtMGY4MzE4MDAzMTRiXkEyXkFqcGdeQXVyNDUzOTQ5MjY@._V1_QL75_UX140_CR0,0,140,207_.jpg",2009,1h 36m,8.3 (1.1M),"78-year-old Carl Fredricksen travels to Paradise Falls in his house equipped with balloons, inadvertently taking a young stowaway."
112,113. A Clockwork Orange,"https://m.media-amazon.com/images/M/MV5BMTY3MjM1Mzc4N15BMl5BanBnXkFtZTgwODM0NzAxMDE@._V1_QL75_UX140_CR0,0,140,207_.jpg",1971,2h 16m,8.3 (886K),Alex DeLarge and his droogs barbarize in a decaying near-future.
113,114. To Kill a Mockingbird,"https://m.media-amazon.com/images/M/MV5BNmVmYzcwNzMtMWM1NS00MWIyLThlMDEtYzUwZDgzODE1NmE2XkEyXkFqcGdeQXVyNzkwMjQ5NzM@._V1_QL75_UX140_CR0,3,140,207_.jpg",1962,2h 9m,8.3 (334K),"Atticus Finch, a widowed lawyer in Depression-era Alabama, defends a Black man against an undeserved rape charge, and tries to educate his young children against prejudice."
114,115. A Separation,"https://m.media-amazon.com/images/M/MV5BN2JmMjViMjMtZTM5Mi00ZGZkLTk5YzctZDg5MjFjZDE4NjNkXkEyXkFqcGdeQXVyMTMxODk2OTU@._V1_QL75_UX140_CR0,0,140,207_.jpg",2011,2h 3m,8.3 (260K),A married couple are faced with a difficult decision - to improve the life of their child by moving to another country or to stay in Iran and look after a deteriorating parent who has Alzheimer's disease.
115,116. The Sting,"https://m.media-amazon.com/images/M/MV5BNGU3NjQ4YTMtZGJjOS00YTQ3LThmNmItMTI5MDE2ODI3NzY3XkEyXkFqcGdeQXVyMjUzOTY1NTc@._V1_QL75_UX140_CR0,3,140,207_.jpg",1973,2h 9m,8.3 (281K),Two grifters team up to pull off the ultimate con.
116,117. Indiana Jones and the Last Crusade,"https://m.media-amazon.com/images/M/MV5BY2Q0ODg4ZmItNDZiYi00ZWY5LTg2NzctNmYwZjA5OThmNzE1XkEyXkFqcGdeQXVyMjM4MzQ4OTQ@._V1_QL75_UX140_CR0,0,140,207_.jpg",1989,2h 7m,8.2 (815K),"In 1938, after his father goes missing while pursuing the Holy Grail, Indiana Jones finds himself up against the Nazis again to stop them from obtaining its powers."
117,118. Die Hard,"https://m.media-amazon.com/images/M/MV5BZjRlNDUxZjAtOGQ4OC00OTNlLTgxNmQtYTBmMDgwZmNmNjkxXkEyXkFqcGdeQXVyNzkwMjQ5NzM@._V1_QL75_UX140_CR0,1,140,207_.jpg",1988,2h 12m,8.2 (951K),A New York City police officer tries to save his estranged wife and several others taken hostage by terrorists during a Christmas party at the Nakatomi Plaza in Los Angeles.
118,119. Like Stars on Earth,"https://m.media-amazon.com/images/M/MV5BMDhjZWViN2MtNzgxOS00NmI4LThiZDQtZDI3MzM4MDE4NTc0XkEyXkFqcGdeQXVyMTMxODk2OTU@._V1_QL75_UY207_CR3,0,140,207_.jpg",2007,2h 42m,8.3 (208K),"An eight-year-old boy is thought to be a lazy trouble-maker, until the new art teacher has the patience and compassion to discover the real problem behind his struggles in school."
119,120. Metropolis,"https://m.media-amazon.com/images/M/MV5BMTg5YWIyMWUtZDY5My00Zjc1LTljOTctYmI0MWRmY2M2NmRkXkEyXkFqcGdeQXVyMTMxODk2OTU@._V1_QL75_UY207_CR0,0,140,207_.jpg",1927,2h 33m,8.3 (187K),"In a futuristic city sharply divided between the working class and the city planners, the son of the city's mastermind falls in love with a working-class prophet who predicts the coming of a savior to mediate their differences."
120,121. Snatch,"https://m.media-amazon.com/images/M/MV5BMTA2NDYxOGYtYjU1Mi00Y2QzLTgxMTQtMWI1MGI0ZGQ5MmU4XkEyXkFqcGdeQXVyNDk3NzU2MTQ@._V1_QL75_UY207_CR1,0,140,207_.jpg",2000,1h 42m,8.2 (916K),"Unscrupulous boxing promoters, violent bookmakers, a Russian gangster, incompetent amateur robbers and supposedly Jewish jewelers fight to track down a priceless stolen diamond."
121,122. 1917,"https://m.media-amazon.com/images/M/MV5BOTdmNTFjNDEtNzg0My00ZjkxLTg1ZDAtZTdkMDc2ZmFiNWQ1XkEyXkFqcGdeQXVyNTAzNzgwNTg@._V1_QL75_UX140_CR0,7,140,207_.jpg",2019,1h 59m,8.2 (685K),"April 6th, 1917. As an infantry battalion assembles to wage war deep in enemy territory, two soldiers are assigned to race against time and deliver a message that will stop 1,600 men from walking straight into a deadly trap."
122,123. L.A. Confidential,"https://m.media-amazon.com/images/M/MV5BMDQ2YzEyZGItYWRhOS00MjBmLTkzMDUtMTdjYzkyMmQxZTJlXkEyXkFqcGdeQXVyNjU0OTQ0OTY@._V1_QL75_UY207_CR1,0,140,207_.jpg",1997,2h 18m,8.2 (622K),"As corruption grows in 1950s Los Angeles, three policemen - one strait-laced, one brutal, and one sleazy - investigate a series of murders with their own brand of justice."
123,124. Bicycle Thieves,"https://m.media-amazon.com/images/M/MV5BNWEwYTIwZDEtNDIwZi00ZmY1LTg1OGYtZDE5NWI2OGRmNmQzXkEyXkFqcGdeQXVyNDUzOTQ5MjY@._V1_QL75_UY207_CR2,0,140,207_.jpg",1948,1h 29m,8.3 (176K),"In post-war Italy, a working-class man's bicycle is stolen, endangering his efforts to find work. He and his son set out to find it."
124,125. Hamilton,"https://m.media-amazon.com/images/M/MV5BNjViNWRjYWEtZTI0NC00N2E3LTk0NGQtMjY4NTM3OGNkZjY0XkEyXkFqcGdeQXVyMjUxMTY3ODM@._V1_QL75_UX140_CR0,0,140,207_.jpg",2020,2h 40m,8.3 (115K),"The real life of one of America's foremost founding fathers and first Secretary of the Treasury, Alexander Hamilton. Captured live on Broadway from the Richard Rodgers Theater with the original Broadway cast."
125,126. Taxi Driver,"https://m.media-amazon.com/images/M/MV5BM2M1MmVhNDgtNmI0YS00ZDNmLTkyNjctNTJiYTQ2N2NmYzc2XkEyXkFqcGdeQXVyNzkwMjQ5NzM@._V1_QL75_UX140_CR0,3,140,207_.jpg",1976,1h 54m,8.2 (928K),"A mentally unstable veteran works as a nighttime taxi driver in New York City, where the perceived decadence and sleaze fuels his urge for violent action."
126,127. Downfall,"https://m.media-amazon.com/images/M/MV5BMTU0NTU5NTAyMl5BMl5BanBnXkFtZTYwNzYwMDg2._V1_QL75_UY207_CR1,0,140,207_.jpg",2004,2h 36m,8.2 (377K),"Traudl Junge, the final secretary for Adolf Hitler, tells of the Nazi dictator's final days in his Berlin bunker at the end of WWII."
127,128. Dangal,"https://m.media-amazon.com/images/M/MV5BMTQ4MzQzMzM2Nl5BMl5BanBnXkFtZTgwMTQ1NzU3MDI@._V1_QL75_UY207_CR4,0,140,207_.jpg",2016,2h 41m,8.3 (213K),Former wrestler Mahavir Singh Phogat and his two wrestler daughters struggle towards glory at the Commonwealth Games in the face of societal oppression.
128,129. For a Few Dollars More,"https://m.media-amazon.com/images/M/MV5BMzJlZTNkYjQtMTE1OS00YTJlLTgxNjItYzg4NTllODdkMzBiXkEyXkFqcGdeQXVyMjUzOTY1NTc@._V1_QL75_UX140_CR0,3,140,207_.jpg",1965,2h 12m,8.2 (277K),"Two bounty hunters with the same intentions team up to track down a gang of outlaws led by a psychotic Mexican bandit, who is plotting an audacious bank robbery."
129,130. Batman Begins,"https://m.media-amazon.com/images/M/MV5BOTY4YjI2N2MtYmFlMC00ZjcyLTg3YjEtMDQyM2ZjYzQ5YWFkXkEyXkFqcGdeQXVyMTQxNzMzNDI@._V1_QL75_UY207_CR0,0,140,207_.jpg",2005,2h 20m,8.2 (1.6M),"After witnessing his parents' death, Bruce learns the art of fighting to confront injustice. When he returns to Gotham as Batman, he must stop a secret society that intends to destroy the city."
130,131. The Wolf of Wall Street,"https://m.media-amazon.com/images/M/MV5BMjIxMjgxNTk0MF5BMl5BanBnXkFtZTgwNjIyOTg2MDE@._V1_QL75_UX140_CR0,0,140,207_.jpg",2013,3h,8.2 (1.6M),"Based on the true story of Jordan Belfort, from his rise to a wealthy stock-broker living the high life to his fall involving crime, corruption and the federal government."
131,132. Some Like It Hot,"https://m.media-amazon.com/images/M/MV5BNzAyOGIxYjAtMGY2NC00ZTgyLWIwMWEtYzY0OWQ4NDFjOTc5XkEyXkFqcGdeQXVyNjU0OTQ0OTY@._V1_QL75_UX140_CR0,5,140,207_.jpg",1959,2h 1m,8.2 (285K),"After two male musicians witness a mob hit, they flee the state in an all-female band disguised as women, but further complications set in."
132,133. Green Book,"https://m.media-amazon.com/images/M/MV5BYzIzYmJlYTYtNGNiYy00N2EwLTk4ZjItMGYyZTJiOTVkM2RlXkEyXkFqcGdeQXVyODY1NDk1NjE@._V1_QL75_UX140_CR0,1,140,207_.jpg",2018,2h 10m,8.2 (581K),A working-class Italian-American bouncer becomes the driver for an African-American classical pianist on a tour of venues through the 1960s American South.
133,134. The Kid,"https://m.media-amazon.com/images/M/MV5BZjhhMThhNDItNTY2MC00MmU1LTliNDEtNDdhZjdlNTY5ZDQ1XkEyXkFqcGdeQXVyNjc1NTYyMjg@._V1_QL75_UX140_CR0,2,140,207_.jpg",1921,1h 8m,8.2 (136K),"The Tramp cares for an abandoned child, but events put their relationship in jeopardy."
134,135. The Father,"https://m.media-amazon.com/images/M/MV5BZGJhNWRiOWQtMjI4OS00ZjcxLTgwMTAtMzQ2ODkxY2JkOTVlXkEyXkFqcGdeQXVyMTkxNjUyNQ@@._V1_QL75_UX140_CR0,0,140,207_.jpg",2020,1h 37m,8.2 (196K),"A man refuses all assistance from his daughter as he ages. As he tries to make sense of his changing circumstances, he begins to doubt his loved ones, his own mind and even the fabric of his reality."
135,136. Judgment at Nuremberg,"https://m.media-amazon.com/images/M/MV5BNDc2ODQ5NTE2MV5BMl5BanBnXkFtZTcwODExMjUyNA@@._V1_QL75_UX140_CR0,1,140,207_.jpg",1961,2h 59m,8.3 (86K),"In 1948, an American court in occupied Germany tries four Nazis judged for war crimes."
136,137. The Truman Show,"https://m.media-amazon.com/images/M/MV5BMDIzODcyY2EtMmY2MC00ZWVlLTgwMzAtMjQwOWUyNmJjNTYyXkEyXkFqcGdeQXVyNDk3NzU2MTQ@._V1_QL75_UX140_CR0,0,140,207_.jpg",1998,1h 43m,8.2 (1.2M),An insurance salesman discovers his whole life is actually a reality TV show.
137,138. All About Eve,"https://m.media-amazon.com/images/M/MV5BYmE1M2Y3NTYtYTI0Mi00N2JlLTkzMzItOTY1MTlhNWNkMDgzXkEyXkFqcGdeQXVyMTUzMDUzNTI3._V1_QL75_UX140_CR0,2,140,207_.jpg",1950,2h 18m,8.2 (140K),Seemingly timid but secretly ruthless ingenue Eve Harrington insinuates herself into the lives of aging Broadway star Margo Channing and her circle of theater friends in this Oscar-winning story.
138,139. Shutter Island,"https://m.media-amazon.com/images/M/MV5BYzhiNDkyNzktNTZmYS00ZTBkLTk2MDAtM2U0YjU1MzgxZjgzXkEyXkFqcGdeQXVyMTMxODk2OTU@._V1_QL75_UX140_CR0,0,140,207_.jpg",2010,2h 18m,8.2 (1.5M),"Teddy Daniels and Chuck Aule, two US marshals, are sent to an asylum on a remote island in order to investigate the disappearance of a patient, where Teddy uncovers a shocking truth about the place."
139,140. Top Gun: Maverick,"https://m.media-amazon.com/images/M/MV5BZWYzOGEwNTgtNWU3NS00ZTQ0LWJkODUtMmVhMjIwMjA1ZmQwXkEyXkFqcGdeQXVyMjkwOTAyMDU@._V1_QL75_UX140_CR0,0,140,207_.jpg",2022,2h 10m,8.2 (713K),"After thirty years, Maverick is still pushing the envelope as a top naval aviator, but must confront ghosts of his past when he leads TOP GUN's elite graduates on a mission that demands the ultimate sacrifice from those chosen to fly it."
140,141. There Will Be Blood,"https://m.media-amazon.com/images/M/MV5BMjAxODQ4MDU5NV5BMl5BanBnXkFtZTcwMDU4MjU1MQ@@._V1_QL75_UX140_CR0,0,140,207_.jpg",2007,2h 38m,8.2 (645K),"A story of family, religion, hatred, oil and madness, focusing on a turn-of-the-century prospector in the early days of the business."
141,142. Casino,"https://m.media-amazon.com/images/M/MV5BMTcxOWYzNDYtYmM4YS00N2NkLTk0NTAtNjg1ODgwZjAxYzI3XkEyXkFqcGdeQXVyNTA4NzY1MzY@._V1_QL75_UX140_CR0,1,140,207_.jpg",1995,2h 58m,8.2 (568K),"In Las Vegas, two best friends - a casino executive and a mafia enforcer - compete for a gambling empire and a fast-living, fast-loving socialite."
142,143. Jurassic Park,"https://m.media-amazon.com/images/M/MV5BMjM2MDgxMDg0Nl5BMl5BanBnXkFtZTgwNTM2OTM5NDE@._V1_QL75_UX140_CR0,1,140,207_.jpg",1993,2h 7m,8.2 (1.1M),A pragmatic paleontologist touring an almost complete theme park on an island in Central America is tasked with protecting a couple of kids after a power failure causes the park's cloned dinosaurs to run loose.
